reviewId,userName,userImage,content,score,thumbsUpCount,reviewCreatedVersion,at,replyContent,repliedAt,appVersion
3e11da0f-556f-4fd0-bc74-7741012cebef,Agusiza Agusiza,https://play-lh.googleusercontent.com/a/ACg8ocIesNJIrS74BnAAYXtKrSVANTneh6d9sFe1k1l1Xq7mo5JSTw=mo,Terima kasih,5,2,2.0.18,2021-04-27 01:20:14,"Hai Kak Agusiza Agusiza, makasih ya atas rating dan reviewnya. Kami merasa senang bisa membantu dan memudahkan Anda. Nikmati beragam Promo dan Informasi terbaru dari Jogjakita. Apabila ada kendala silakan menghubungi melalui LiveChat/Call Center Jogjakita 08222-6657-999",2021-04-29 10:26:29,2.0.18
b0dfcfaf-c444-47ca-8c8d-4e7617ab7686,Di A,https://play-lh.googleusercontent.com/a-/ALV-UjVZXP5AAanH5lunihqy6vGR-wk4l0fYEG80Uz195k6NqWzqXsA8,"harga makanan banyak yg berbeda dari yg di aplikasi,, saya pesan 4x harganya berbeda semua",1,0,2.0.18,2021-04-26 20:31:25,"Hai Kak Di A, makasih atas rating dan reviewnya. Kami akan menjadikan ini sebagai masukan untuk pengembangan produk kami selanjutnya. Jogjakita akan terus berusaha melengkapi dan meningkatkan layanan untuk pelanggan setia seperti Anda. Jika ada kendala bisa lho contact tim CS kami melalui livechat/call center 082226657999",2021-04-29 10:47:53,2.0.18
9ae81d84-04c7-4acb-9ea6-9f8d58b5a6b5,Sidiq “Tour Travel” Zamruddhin,https://play-lh.googleusercontent.com/a-/ALV-UjXRhv61ruq2nqsBs1Y2o44nJfZp4NNoB3C_xBwZGnqMqMf8jfE,sip,5,2,2.0.16,2021-04-26 17:59:38,"Hai Kak Sidiq Zamruddhin, makasih atas rating dan reviewnya. Semoga dengan adanya Jogjakita, kamu mendapatkan kemudahan bertransaksi. Yuk kepoin beragam promo dan kuis via media sosial kami ya. Kalo ada kendala bisa lho contact tim CS kami melalui livechat/call center 082226657999",2021-04-29 10:13:54,2.0.16
0aa0c059-afe3-4b42-9862-a80e98cda197,INDRA MUHARTO,https://play-lh.googleusercontent.com/a-/ALV-UjVfbJ5F82Os9etJhC-gT7wl8I3g0uzV5SQTbihkwbE50uOZcwtP,Untuk aplikasi awal tak kasih bintang 3. Dulu,3,0,2.0.18,2021-04-26 13:08:20,"Hai Kak INDRA MUHARTO, makasih atas rating dan reviewnya. Kami akan menjadikan ini sebagai masukan untuk pengembangan produk kami selanjutnya. Jogjakita akan terus berusaha melengkapi dan meningkatkan layanan untuk pelanggan setia seperti Anda. Jika ada kendala bisa lho contact tim CS kami melalui livechat/call center 082226657999",2021-04-29 10:13:24,2.0.18
9ca3700e-0e93-41fc-94da-cf53961c2d7e,uffi mufidah,https://play-lh.googleusercontent.com/a-/ALV-UjW_Y0QBjHG9IbCfdFrdK5altlGd4Mp0RK-CMAZ9D4a4etuYNqEL,Suka logout sendiri klo lama ga dibuka aplikasi nya.,3,1,,2021-04-26 11:59:09,"Hai Kak uffi mufidah, makasih atas rating dan reviewnya. Selamat bergabung di Jogjakita. Semoga dengan layanan Jogjakita dapat membantu kemudahan Anda dalam bertransaksi. Nikmati juga beragam promo dan info terbaru dari Jogjakita tiap bulannya.",2021-04-29 10:16:47,
0436ad51-b510-4dc5-bb45-682d94f0d2eb,umi zaenah,https://play-lh.googleusercontent.com/a-/ALV-UjWWBXw0LJnDUMkjEULGCKJtW3lQFFHtvx6cdni_gMBCz9J7gJ8,Belanja bersama Luwes Mumtaz free ongkir,4,0,,2021-04-26 11:24:12,"Hai Kak umi zaenah, makasih atas rating dan reviewnya. Semoga dengan adanya Jogjakita, kamu mendapatkan kemudahan bertransaksi. Yuk kepoin beragam promo dan kuis via media sosial kami ya. Kalo ada kendala bisa lho contact tim CS kami melalui livechat/call center 082226657999",2021-04-29 10:14:31,
c73a55f5-c4e7-4507-a511-9ab2bb1126db,Yulio Iskandar,https://play-lh.googleusercontent.com/a-/ALV-UjU4KGxCKOjTd9929yU5lucBAV-CBKp_xZD8xHBebroMlct5M_eJ,Apik,5,2,,2021-04-25 23:16:06,"Hai Kak Yulio Iskandar, makasih atas rating dan reviewnya. Semoga dengan adanya Jogjakita, kamu mendapatkan kemudahan bertransaksi. Yuk kepoin beragam promo dan kuis via media sosial kami ya. Kalo ada kendala bisa lho contact tim CS kami melalui livechat/call center 082226657999",2021-04-29 10:14:34,
a38329e4-08b2-44cf-a8ae-48b4b5ca0cf3,Awalul Khasanah,https://play-lh.googleusercontent.com/a/ACg8ocLCSXm7079d_L_7zTwDQzicrS6FNMK8irZv1CVL2GAbZEmLmw=mo,Mantap,5,2,2.0.16,2021-04-24 18:09:23,"Hai Kak Awalul Khasanah, makasih atas rating dan reviewnya. Semoga dengan adanya Jogjakita, kamu mendapatkan kemudahan bertransaksi. Yuk kepoin beragam promo dan kuis via media sosial kami ya. Kalo ada kendala bisa lho contact tim CS kami melalui livechat/call center 082226657999",2021-04-29 10:14:49,2.0.16
a6ab2679-f12f-43a7-a59d-24645c8ed4b2,Eka Prasetya,https://play-lh.googleusercontent.com/a/ACg8ocLR-U5j_38_XxXBA7fV2QxNLYh08eYyzFEySlUQP1W744VZfA=mo,"Tidak tau mengapa,tiba2 akkun dibekukan,padahal seering buat pesan food",1,0,,2021-04-24 09:04:55,"Hai Kak Eka Prasetya, makasih atas rating dan reviewnya. Selamat bergabung di Jogjakita. Semoga dengan layanan Jogjakita dapat membantu kemudahan Anda dalam bertransaksi. Nikmati juga beragam promo dan info terbaru dari Jogjakita tiap bulannya.",2021-04-29 10:16:26,
a4621474-a671-47d3-92b5-5831ab0a6c71,Decky Rahmantya,https://play-lh.googleusercontent.com/a/ACg8ocJT-ficmPakhcSMhdkSnBNyQG-ffLuNOnFdoBD3EFcT7v_lQQ=mo,Bagus sekali sangat membantu warga jogja,5,2,2.0.18,2021-04-23 21:08:32,"Hai Kak Decky Rahmantya, makasih atas rating dan reviewnya. Semoga dengan adanya Jogjakita, kamu mendapatkan kemudahan bertransaksi. Yuk kepoin beragam promo dan kuis via media sosial kami ya. Kalo ada kendala bisa lho contact tim CS kami melalui livechat/call center 082226657999",2021-04-29 10:15:11,2.0.18
103b2422-0cef-44d6-9a2f-f6dd1f997a32,Anggi Tyas Pradipta,https://play-lh.googleusercontent.com/a/ACg8ocJe3HhE_oo_B9G665GKJoAEK9NVEerCS6uSigGmejDVzrMKsg=mo,Aplikasi susah digunakan,1,0,2.0.15,2021-04-23 16:40:05,"Hai Kak Anggi Tyas Pradipta, makasih atas rating dan reviewnya. Kami akan menjadikan ini sebagai masukan untuk pengembangan produk kami selanjutnya. Jogjakita akan terus berusaha melengkapi dan meningkatkan layanan untuk pelanggan setia seperti Anda. Jika ada kendala bisa lho contact tim CS kami melalui livechat/call center 082226657999",2021-04-29 10:10:38,2.0.15
00f7b602-ee87-4058-ba67-bd953fd15e73,Adi Yuda,https://play-lh.googleusercontent.com/a-/ALV-UjWmDyEraq2gQyVfYuYfYG_oO3vgPVEGphheSW64QzCgX3y8nSXG,susahnya mau pick lokasi pengantaran maps tidak muncul.. harus pakai tulis alamat kah? repot ribet..,2,0,2.0.18,2021-04-23 14:10:35,"Hai Kak Adi Yuda, makasih atas rating dan reviewnya. Kami akan menjadikan ini sebagai masukan untuk pengembangan produk kami selanjutnya. Jogjakita akan terus berusaha melengkapi dan meningkatkan layanan untuk pelanggan setia seperti Anda. Jika ada kendala bisa lho contact tim CS kami melalui livechat/call center 082226657999",2021-04-29 10:11:06,2.0.18
8f98572f-2236-49b9-8a56-e1677b525375,Cempluk Bono,https://play-lh.googleusercontent.com/a/ACg8ocI70-vXHsxvzU8n1F1-9aEJOjNatySdZTuDYRRpa94q7yFNfQ=mo,Promonya ditingkatkan min,5,2,,2021-04-23 13:28:43,"Hai Kak Cempluk Bono, makasih atas rating dan reviewnya. Kami akan menjadikan ini sebagai masukan untuk pengembangan produk kami selanjutnya. Jogjakita akan terus berusaha melengkapi dan meningkatkan layanan untuk pelanggan setia seperti Anda. Jika ada kendala bisa lho contact tim CS kami melalui livechat/call center 082226657999",2021-04-29 10:11:21,
46aa79ed-20bc-4cba-834b-c2b3e371b7f6,Yusuf Suharman,https://play-lh.googleusercontent.com/a-/ALV-UjXhGTlLF_g89709FrSbMUeERRyyxbI7GyqMuGqPjRJxTh2B1cJ3,Aplikasi apaan mana pesan sejam kemudian baru datang ojeknya,1,0,,2021-04-23 12:51:29,"Hai Kak Yusuf Brawijaya, makasih atas rating dan reviewnya. Kami akan menjadikan ini sebagai masukan untuk pengembangan produk kami selanjutnya. Jogjakita akan terus berusaha melengkapi dan meningkatkan layanan untuk pelanggan setia seperti Anda. Jika ada kendala bisa lho contact tim CS kami melalui livechat/call center 082226657999",2021-04-29 10:11:32,
0e5449c4-3839-4a70-91b2-b7f258bd5d66,Reog Mete,https://play-lh.googleusercontent.com/a/ACg8ocLJYDA2SzP73gXxqAYAvgrPd0BbA7byLFo2gbi2q4OTZK8K5g=mo,Tes ride,5,2,2.0.16,2021-04-22 19:34:18,"Hai Kak Reog Mete, makasih atas rating dan reviewnya. Kami akan menjadikan ini sebagai masukan untuk pengembangan produk kami selanjutnya. Jogjakita akan terus berusaha melengkapi dan meningkatkan layanan untuk pelanggan setia seperti Anda. Jika ada kendala bisa lho contact tim CS kami melalui livechat/call center 082226657999",2021-04-29 10:11:45,2.0.16
5a1ae81d-ee49-47d4-bbad-39860f644c45,Sri Paryanti,https://play-lh.googleusercontent.com/a-/ALV-UjX7vZLuTFjzrFuiYfc6vFcozZZVG55ol15L3eCGBk1OEnb9VaN76w,Cara make promo jogjaride yg 5000 gimana ya??,5,2,2.0.18,2021-04-22 10:40:16,"Hai Kak Sri Paryanti, makasih atas rating dan reviewnya. Kami akan menjadikan ini sebagai masukan untuk pengembangan produk kami selanjutnya. Jogjakita akan terus berusaha melengkapi dan meningkatkan layanan untuk pelanggan setia seperti Anda. Jika ada kendala bisa lho contact tim CS kami melalui livechat/call center 082226657999",2021-04-29 10:11:59,2.0.18
c1dce11e-45b9-41bc-84b9-94581a731ea8,Odilia Larasati,https://play-lh.googleusercontent.com/a/ACg8ocJ7GfPemSYjLCwOEKuz3y85Gvs7aKJUZY-vyLskABuQkVw1zw=mo,"Aplikasi gak jelas! Awal2 aja lancar. Tiba2 logout sendiri, gak visa login. Pdhl msh punya saldo speedcash. Gak jelas bgt. Parah!",1,0,2.0.18,2021-04-21 15:34:24,"Hai Kak Odilia Larasati, makasih ya atas rating dan reviewnya. Kami sangat mengapresiasi perhatian Anda kepada Jogjakita. Kami akan selalu berbenah dan berusaha memberikan yg terbaik untuk mitra kami. Apabila ada kendala silakan menghubungi melalui LiveChat/Call Center Jogjakita 08222-6657-999",2021-04-22 01:16:01,2.0.18
5c62f31c-6ddc-45da-857a-43c18f456112,Aziz Trikusumq,https://play-lh.googleusercontent.com/a/ACg8ocJZBBx-oGN-38nYMXR8HQx0o_KKYaHgnkBiHQEyh21ofSwslA=mo,Apakah promo #5000 masih ada..?,1,0,2.0.17,2021-04-21 13:10:08,"Hai Kak Aziz Trikusumq, makasih ya atas rating dan reviewnya. Kami sangat mengapresiasi perhatian Anda kepada Jogjakita. Kami akan selalu berbenah dan berusaha memberikan yg terbaik untuk mitra kami. Apabila ada kendala silakan menghubungi melalui LiveChat/Call Center Jogjakita 08222-6657-999",2021-04-22 01:15:26,2.0.17
16b28ff9-09d3-4bf5-9546-1d8d784e0900,Arturo Valentino,https://play-lh.googleusercontent.com/a-/ALV-UjXNs9jrIvd4uA3cUfNjd9iS9D5jGggL21z3rembdp45xM4CFEw,"Penjemputan lama, kurang bisa diandalkan",2,1,2.0.18,2021-04-21 12:45:31,"Hai Kak Arturo Valentino, makasih ya atas rating dan reviewnya. Kami sangat mengapresiasi perhatian Anda kepada Jogjakita. Kami akan selalu berbenah dan berusaha memberikan yg terbaik untuk mitra kami. Apabila ada kendala silakan menghubungi melalui LiveChat/Call Center Jogjakita 08222-6657-999",2021-04-22 01:15:11,2.0.18
53545965-2eb1-4e1d-ba29-a495ea67fe54,Roy Permadi,https://play-lh.googleusercontent.com/a-/ALV-UjWsSqF3N4d-YxXnuYunRJd0FUUAoUFtj4szpL1p4bWC7q5j5Yr2,Bagus murah ... Sangat membantu Isi saldo pulsa dll lancar n cepat ada notifikasi Bnyk promo Promo 5000an sampai kapan ya kak?,5,5,2.0.18,2021-04-20 22:38:26,"Hallo Kak Roy Permadi, makasih ya atas rating dan reviewnya. Seneng banget nih kalo Jogjakita bisa memberikan manfaat buat Anda. Yuk kepoin promo dari kami via media sosial Jogjakita yang tentunya always update. Jangan ragu jika butuh info atau kendala bisa japri CS kami melalui LiveChat/Call Center 08222-6657-999",2021-04-22 01:12:43,2.0.18
fb174ad6-729d-443c-a108-06f429a9f01b,Roby Nugroho,https://play-lh.googleusercontent.com/a/ACg8ocK1glNSApdDwfh9BC4ejFnQ9cVRa-MZK7QFCgPRGSDTzYPXyg=mo,Kok gak bisa ya,4,0,2.0.18,2021-04-20 19:34:55,"Hallo Kak Roby Nugroho, makasih ya atas rating dan reviewnya. Seneng banget nih kalo Jogjakita bisa memberikan manfaat buat Anda. Yuk kepoin promo dari kami via media sosial Jogjakita yang tentunya always update. Jangan ragu jika butuh info atau kendala bisa japri CS kami melalui LiveChat/Call Center 08222-6657-999",2021-04-22 01:13:14,2.0.18
1c3c0282-e371-43e7-a0b3-23f487fdf323,lia yurnalis,https://play-lh.googleusercontent.com/a-/ALV-UjWGyL_sdDAieUv6HaK0TpjQHkdefZUsjYxqOGpOnn4xDiS72y2L,"Kasih bintang 3 aja dulu, promo dan voucher suka hilang², seperti voucher ride di situ tertulis smpai tahun 2022 tapi kok tiba tiba hilang begitu saja Tolong di perbaiki dongg, biar langganan ride yang tidak bertnya² tentang promo ride nya Trimkasih",3,8,2.0.18,2021-04-20 14:49:23,"Hallo Kak lia yurnalis, makasih ya atas rating dan reviewnya. Seneng banget nih kalo Jogjakita bisa memberikan manfaat buat Anda. Yuk kepoin promo dari kami via media sosial Jogjakita yang tentunya always update. Jangan ragu jika butuh info atau kendala bisa japri CS kami melalui LiveChat/Call Center 08222-6657-999",2021-04-22 01:13:32,2.0.18
8f15b65a-5149-4bef-905a-e44ac33908e4,Fitri Anto,https://play-lh.googleusercontent.com/a-/ALV-UjVzAiv91MgJqRkmZghILP3TRWxFyhpXAqyV4KEDymOWKndKEZI,Jossss,5,2,,2021-04-20 14:37:50,"Hallo Kak Fitri Anto, makasih ya atas rating dan reviewnya. Seneng banget nih kalo Jogjakita bisa memberikan manfaat buat Anda. Yuk kepoin promo dari kami via media sosial Jogjakita yang tentunya always update. Jangan ragu jika butuh info atau kendala bisa japri CS kami melalui LiveChat/Call Center 08222-6657-999",2021-04-22 01:13:47,
b8d4b8f8-59cb-4fd7-8f7f-1fab86dab6e6,Slamet Sujarwo,https://play-lh.googleusercontent.com/a/ACg8ocJ1VroXP4WynkmNMSO0LPHtCq58mjTC4ke-BDAQGGQsOuspxA=mo,"Sedikit saran, alangkah lebih baik jika promo goride ada lagi, agar jogjakita makin di kenal banyak orang,",3,1,,2021-04-20 14:07:01,"Hallo Kak Slamet Sujarwo, makasih ya atas rating dan reviewnya. Seneng banget nih kalo Jogjakita bisa memberikan manfaat buat Anda. Yuk kepoin promo dari kami via media sosial Jogjakita yang tentunya always update. Jangan ragu jika butuh info atau kendala bisa japri CS kami melalui LiveChat/Call Center 08222-6657-999",2021-04-22 01:14:00,
35167c7d-c568-4c71-8234-027591f1b6fd,maulana 13,https://play-lh.googleusercontent.com/a-/ALV-UjUdtfdYKkPvDzBx23UhQr7IONkfVjl-K5jDqI4gnMemRDFj8Gw,Perlu di tingkatkan dukung produk lokal untuk berkembang,5,4,2.0.18,2021-04-20 12:12:07,"Hallo Kak maulana 13, makasih ya atas rating dan reviewnya. Seneng banget nih kalo Jogjakita bisa memberikan manfaat buat Anda. Yuk kepoin promo dari kami via media sosial Jogjakita yang tentunya always update. Jangan ragu jika butuh info atau kendala bisa japri CS kami melalui LiveChat/Call Center 08222-6657-999",2021-04-22 01:14:17,2.0.18
61acd7a6-11f1-4295-813c-41bef7e443d1,Muhammad Aldy Muhaimin,https://play-lh.googleusercontent.com/a/ACg8ocK0yXK_hPr9TkHxS-2UvfeEqYQWZtEwXfjX3I3kpNrswIB9FA=mo,Akurasi maps minus aplikasi lag parah,1,0,2.0.18,2021-04-20 11:50:56,"Hallo Kak Muhammad Aldy Muhaimin, makasih ya atas rating dan reviewnya. Seneng banget nih kalo Jogjakita bisa memberikan manfaat buat Anda. Yuk kepoin promo dari kami via media sosial Jogjakita yang tentunya always update. Jangan ragu jika butuh info atau kendala bisa japri CS kami melalui LiveChat/Call Center 08222-6657-999",2021-04-22 01:14:30,2.0.18
7fa436ba-9e0e-44ae-b5ba-5f3c9c8cf664,Wahyu Nugroho,https://play-lh.googleusercontent.com/a-/ALV-UjXemieCXeM1UYBXCF0nqWCMrddFUSY88-jYQR9ttGPIsU3G8geM,Promo customer diperbanyak,5,2,2.0.18,2021-04-20 10:33:33,"Hallo Kak Wahyu Nugroho, makasih ya atas rating dan reviewnya. Seneng banget nih kalo Jogjakita bisa memberikan manfaat buat Anda. Yuk kepoin promo dari kami via media sosial Jogjakita yang tentunya always update. Jangan ragu jika butuh info atau kendala bisa japri CS kami melalui LiveChat/Call Center 08222-6657-999",2021-04-22 01:14:45,2.0.18
2feb1562-79bc-4af5-88e0-e546e77f0895,Fredy Caknan,https://play-lh.googleusercontent.com/a/ACg8ocKvHMpsHzQZ_Ad4FxTQpxiT7ZcDWQnKoRay_mlYZxdMxYI-Gw=mo,Promo ride sudah gak ada gak recomend buat tmn sdra naik mahal mending apk grab banyak diskon dan promonya. Gak membantu tarif normal dan mahal judulnya mau ngirit malah jd borossss.........,1,0,,2021-04-20 08:38:54,"Hai Kak Fredy Caknan, makasih atas rating dan reviewnya. Kami akan menjadikan ini sebagai masukan untuk pengembangan produk kami selanjutnya. Jogjakita akan terus berusaha melengkapi dan meningkatkan layanan untuk pelanggan setia seperti Anda. Jika ada kendala bisa lho contact tim CS kami melalui livechat/call center 082226657999",2021-04-22 01:09:31,
3810a804-c6ac-4395-895e-6667c2e5fdfc,Hargi Yanto,https://play-lh.googleusercontent.com/a/ACg8ocKwAsavq6qY0nzwnsGBaRNWDompN6c8mOoT61Nvnch0dLPvVA=mo,Sutuh update pelayanan sama aja,1,0,2.0.18,2021-04-20 07:52:10,"Hai Kak Hargi Yanto, makasih atas rating dan reviewnya. Kami akan menjadikan ini sebagai masukan untuk pengembangan produk kami selanjutnya. Jogjakita akan terus berusaha melengkapi dan meningkatkan layanan untuk pelanggan setia seperti Anda. Jika ada kendala bisa lho contact tim CS kami melalui livechat/call center 082226657999",2021-04-22 01:09:45,2.0.18
ac189326-8b6f-499c-b07d-e2f9a8970967,Hendra yudha saputra,https://play-lh.googleusercontent.com/a-/ALV-UjWJoI2Lvha7yP2qxcZMJCzPkGn-5nhWdq9S0E0s7BXOztW8i_Y,Kalau boleh usul nih jogjakita tidak hanya buat yg ber KTP Jogja saja dengan begitu bisa merekrut semua driver si hijau dari luar negeri itu soalnya mumpung si hijau sudah mulai banyak tingkah terhadap drivernya terakhir si hijau bikin wacana dan bikin survey penyewaan motor listrik yg per harinya hampir menyentuh Rp. 50.000,4,1,,2021-04-20 04:30:06,"Hai Kak Hendra yudha saputra , makasih atas rating dan reviewnya. Kami akan menjadikan ini sebagai masukan untuk pengembangan produk kami selanjutnya. Jogjakita akan terus berusaha melengkapi dan meningkatkan layanan untuk pelanggan setia seperti Anda. Jika ada kendala bisa lho contact tim CS kami melalui livechat/call center 082226657999",2021-04-22 01:09:59,
858775fd-6039-4f9a-b43a-a780fc3867fa,AGUS MOH NURDIN,https://play-lh.googleusercontent.com/a-/ALV-UjV7I8t814uwoXrEVFAMYcVH2oloouqaK5itEjWdCYD4_i_ru7k,Mantap,5,2,2.0.16,2021-04-20 00:56:13,"Hai Kak AGUS MOH NURDIN , makasih atas rating dan reviewnya. Kami akan menjadikan ini sebagai masukan untuk pengembangan produk kami selanjutnya. Jogjakita akan terus berusaha melengkapi dan meningkatkan layanan untuk pelanggan setia seperti Anda. Jika ada kendala bisa lho contact tim CS kami melalui livechat/call center 082226657999",2021-04-22 01:10:10,2.0.16
f1c28138-1b03-455d-9c41-c296861ad21f,Bu Warsi,https://play-lh.googleusercontent.com/a/ACg8ocLhZXy4MLzWaDLTg8zbY5RXOYOXyEXWK28C-PkuZyVtpWZsQA=mo,oke,5,2,2.0.16,2021-04-19 20:13:04,"Hai Kak Bu Warsi, makasih atas rating dan reviewnya. Kami akan menjadikan ini sebagai masukan untuk pengembangan produk kami selanjutnya. Jogjakita akan terus berusaha melengkapi dan meningkatkan layanan untuk pelanggan setia seperti Anda. Jika ada kendala bisa lho contact tim CS kami melalui livechat/call center 082226657999",2021-04-22 01:10:35,2.0.16
8359fb68-7235-4186-83b5-e6c4c0801d41,stanislaus jebarus,https://play-lh.googleusercontent.com/a-/ALV-UjXS9oeGii5FOWFoNzClbORoKqBriUyesoi6egT-D_RktJoi0AQP,Gak responsif CSnya,1,0,2.0.18,2021-04-19 18:09:17,"Hai Kak Lempes tv, makasih atas rating dan reviewnya. Kami akan menjadikan ini sebagai masukan untuk pengembangan produk kami selanjutnya. Jogjakita akan terus berusaha melengkapi dan meningkatkan layanan untuk pelanggan setia seperti Anda. Jika ada kendala bisa lho contact tim CS kami melalui livechat/call center 082226657999",2021-04-22 01:10:56,2.0.18
00aef792-8397-47bb-9308-cb7fb5220eef,Ratu Barbie,https://play-lh.googleusercontent.com/a-/ALV-UjUxWULjq2BMrvySeMi7qScfPNKwJMr1bSn7xJKTaYrsVaYf6AEi,Sekarang tarif nya mahal ikut ikutan ojek sebelah. Murah hanya pas launching doang. Kalo mau pergi jauh diatas 10km mungkin dsuruh naik bus aja kali ya yg murah,1,10,2.0.18,2021-04-19 18:02:08,"Hai Kak Ratu Barbie, makasih atas rating dan reviewnya. Kami akan menjadikan ini sebagai masukan untuk pengembangan produk kami selanjutnya. Jogjakita akan terus berusaha melengkapi dan meningkatkan layanan untuk pelanggan setia seperti Anda. Jika ada kendala bisa lho contact tim CS kami melalui livechat/call center 082226657999",2021-04-22 01:11:11,2.0.18
42d88dd1-788f-4a80-a9c5-b98d92788191,Aguslistiyo Agus,https://play-lh.googleusercontent.com/a-/ALV-UjWZRxL4cpBkPtyvNyHWZ0lwYqmJTBFuQbbZbpbjmrJcCoeXZcRv,Sudah tidak ad promo 5000..pasti kalah sama yg laen..promo cuman pagi...sedangkan sore jg siang bnyak yg mw menggunakan..al hasil pindah yg ad promonya...maaf geh...,1,0,2.0.18,2021-04-19 14:13:44,"Hai Kak Aguslistiyo Agus, makasih atas rating dan reviewnya. Kami akan menjadikan ini sebagai masukan untuk pengembangan produk kami selanjutnya. Jogjakita akan terus berusaha melengkapi dan meningkatkan layanan untuk pelanggan setia seperti Anda. Jika ada kendala bisa lho contact tim CS kami melalui livechat/call center 082226657999",2021-04-22 01:11:28,2.0.18
9791cd1c-d58c-4080-a32c-1711e062fa8c,Isti Isti Isti,https://play-lh.googleusercontent.com/a/ACg8ocIn_euAXsErrLLEh1mgHTeL6Qsm9P43wwxBWlsUpxsboS0Frg=mo,👍👍👍,5,2,2.0.17,2021-04-19 12:16:49,"Hai Kak Isti Isti Isti, makasih ya atas rating dan reviewnya. Jangan lupa ajakin teman dan keluarga Anda biar menggunakan Jogjakita dan dapatkan promo menarik tiap minggunya. Jika ada kendala bisa lho contact tim CS kami melalui livechat/call center 082226657999",2021-04-22 01:09:03,2.0.17
bd19b748-3516-4b78-b055-4df9eaf8ea37,tonzz tonni,https://play-lh.googleusercontent.com/a/ACg8ocKCQTZ929rcZueyhARS8m_9sCs3PA8PTthMq0BqNAfnQifmww=mo,Selalu mendapatkan driver yg jauh dari tmpat saya,1,0,2.0.18,2021-04-19 11:51:01,"Hai Kak tonzz tonni, makasih ya atas rating dan reviewnya. Jangan lupa ajakin teman dan keluarga Anda biar menggunakan Jogjakita dan dapatkan promo menarik tiap minggunya. Jika ada kendala bisa lho contact tim CS kami melalui livechat/call center 082226657999",2021-04-22 01:08:48,2.0.18
60ba3675-a396-4418-8738-eeffaff0db7a,petrus andang,https://play-lh.googleusercontent.com/a-/ALV-UjXxCq51jIvF4L-8VVndwBTjklFdj73ntRO-QUsGX7ERjcupMpQL,Istimewa ..👍,5,2,2.0.18,2021-04-19 10:00:40,"Hai Kak petrus andang, makasih ya atas rating dan reviewnya. Jangan lupa ajakin teman dan keluarga Anda biar menggunakan Jogjakita dan dapatkan promo menarik tiap minggunya. Jika ada kendala bisa lho contact tim CS kami melalui livechat/call center 082226657999",2021-04-22 01:08:35,2.0.18
bbb504b2-f663-4609-953a-ae8f4debda93,mimie joned,https://play-lh.googleusercontent.com/a-/ALV-UjUwGSmylRqNG7SFjbi77OLhCRea1Kp-HKiKoOdSunwH-JEyuWc,3 rumiyen njeh,3,0,2.0.15,2021-04-19 01:31:36,"Hai Kak mimie joned, makasih ya atas rating dan reviewnya. Jangan lupa ajakin teman dan keluarga Anda biar menggunakan Jogjakita dan dapatkan promo menarik tiap minggunya. Jika ada kendala bisa lho contact tim CS kami melalui livechat/call center 082226657999",2021-04-22 01:08:02,2.0.15
0ea5b97d-d457-4465-b496-8e8f726832eb,Aloysius Al Adam,https://play-lh.googleusercontent.com/a-/ALV-UjWh5gBNXnIaDSU5K6tHtqpwft7qGX73oNnIf6exvfZwhfDOpOsMfQ,"Perlu segera dibenahi. Untuk alamat pengambilan/penjemputan terbalik dengan alamat pengantaran. Harusnya driver datang ke restonya (titik pengambilan) dulu, baru diantar ke customer (titik pengantaran). Ini malah datang ke customer (titik pengantaran), diantar ke resto (titik pengambilan). Gokil :D",4,3,2.0.18,2021-04-18 23:54:10,"Hai Kak Aloysius Al Adam, makasih ya atas rating dan reviewnya. Jangan lupa ajakin teman dan keluarga Anda biar menggunakan Jogjakita dan dapatkan promo menarik tiap minggunya. Jika ada kendala bisa lho contact tim CS kami melalui livechat/call center 082226657999",2021-04-22 01:07:48,2.0.18
65481b0c-dbbd-4b9f-b869-f18fb7f5a18c,Heri Marsanto,https://play-lh.googleusercontent.com/a-/ALV-UjWEQR-ktGqAdYQeHawdcx8wDQdaVLT1xpnoXMbLdowTA-DM1v35LQ,Sukses selalu...,5,2,,2021-04-18 20:53:52,"Hai Kak Heri Marsanto, makasih ya atas rating dan reviewnya. Jangan lupa ajakin teman dan keluarga Anda biar menggunakan Jogjakita dan dapatkan promo menarik tiap minggunya. Jika ada kendala bisa lho contact tim CS kami melalui livechat/call center 082226657999",2021-04-22 01:07:33,
aba39617-1c4d-47ac-aefc-93af31c5aa70,GRINGGO CHANNEL,https://play-lh.googleusercontent.com/a-/ALV-UjVvN1jzpiQjZLl_r33OczxMiU0dcHysw_A_UvF8rbW2JU8QSldy,tidak dapat tersambung ke server kak.. tolong infonya...maacih,1,0,2.0.18,2021-04-18 20:36:28,"Hai Kak GRINGGO CHANNEL, makasih ya atas rating dan reviewnya. Jangan lupa ajakin teman dan keluarga Anda biar menggunakan Jogjakita dan dapatkan promo menarik tiap minggunya. Jika ada kendala bisa lho contact tim CS kami melalui livechat/call center 082226657999",2021-04-22 01:07:20,2.0.18
8f19cdb2-fc08-4ed7-b56a-bfe0e81e6afd,Untung Nugroho,https://play-lh.googleusercontent.com/a/ACg8ocI3OR-dC48q8sIgLeycQxddToV-MumQvD3CpZimB_Evd_frng=mo,Tambah bagus,5,2,2.0.17,2021-04-18 19:25:30,"Hai Kak Untung Nugroho, makasih ya atas rating dan reviewnya. Jangan lupa ajakin teman dan keluarga Anda biar menggunakan Jogjakita dan dapatkan promo menarik tiap minggunya. Jika ada kendala bisa lho contact tim CS kami melalui livechat/call center 082226657999",2021-04-22 01:07:05,2.0.17
b134b3ca-6bdc-42e5-971e-c34da4f21752,Yulia Ona,https://play-lh.googleusercontent.com/a/ACg8ocLSk3qrRgvhA9_jSnnl24sVYKxpuXuklwCXZK84UQuRMDMaPA=mo,Mantap dan sangat membantu,5,2,,2021-04-18 18:57:53,"Hai Kak Yulia Ona, makasih ya atas rating dan reviewnya. Jangan lupa ajakin teman dan keluarga Anda biar menggunakan Jogjakita dan dapatkan promo menarik tiap minggunya. Jika ada kendala bisa lho contact tim CS kami melalui livechat/call center 082226657999",2021-04-22 01:06:54,
81c78c29-cec0-480d-bc1e-7c94993ba284,Agil Suratmi,https://play-lh.googleusercontent.com/a/ACg8ocI7V3ZxROT882Cxei8_N7cAFf2OiuIEv2JtEm9SpjdrQbycdQ=mo,"Tlg fitur catnya kl pas PESen jokit mau cat sama driver nya masak hampir 5 menitan Bru bisa dicat driver,",3,0,,2021-04-18 17:39:47,"Hai Kak Agil Suratmi, makasih ya buat rating dan reviewnya. Jogjakita bakalan terus berusaha melengkapi dan meningkatkan layanan untuk pelanggan seperti kamu, iya kamu. Untuk informasi dan bantuan contact Customer Support kami melalui livechat/ call center 082226657999 ya",2021-04-22 01:06:26,
