reviewId,userName,userImage,content,score,thumbsUpCount,reviewCreatedVersion,at,replyContent,repliedAt,appVersion
afd5107a-c2c4-4ddb-8af7-d55725ccb201,Dio Setiadi,https://play-lh.googleusercontent.com/a-/ALV-UjXY542OjlVrpIbFiawQbWmE-1WYjEGjeHiNmQPD2KMmaUs,Jogja istimmeewwaa👍👍,5,2,2.0.16,2021-03-19 22:44:46,"Hai Kak Dio Setiadi, makasih atas rating dan reviewnya. Selamat bergabung di Jogjakita. Semoga dengan layanan Jogjakita dapat membantu kemudahan Anda dalam bertransaksi. Nikmati juga beragam promo dan info terbaru dari Jogjakita tiap bulannya.",2021-03-20 10:54:12,2.0.16
a570f1c8-4b24-4630-9434-ac60e45538eb,Sri Wasiati,https://play-lh.googleusercontent.com/a/ACg8ocIVOJbcFk24rWzX_BJb-y2yS8vCcW-Ex1OA5WYcY_8_=mo,Jogja istimewaa👍,5,2,,2021-03-19 22:42:17,"Hai Kak Sri Wasiati, makasih atas rating dan reviewnya. Selamat bergabung di Jogjakita. Semoga dengan layanan Jogjakita dapat membantu kemudahan Anda dalam bertransaksi. Nikmati juga beragam promo dan info terbaru dari Jogjakita tiap bulannya.",2021-03-20 10:49:03,
5a9a8562-255c-48a6-ae01-2775dd020a6f,Buah kelapa,https://play-lh.googleusercontent.com/a/ACg8ocI_FqU8N1D0Wl8YsQ9ShF2g0Z5pe1FhYWD1859mMqlR=mo,Semoga jogjakita bisa berkembang lebih baik lagi,5,3,,2021-03-19 21:51:29,"Hai Kak Buah kelapa, makasih atas rating dan reviewnya. Selamat bergabung di Jogjakita. Semoga dengan layanan Jogjakita dapat membantu kemudahan Anda dalam bertransaksi. Nikmati juga beragam promo dan info terbaru dari Jogjakita tiap bulannya.",2021-03-20 10:48:52,
7277e587-cce1-43e2-84b3-c10b15ff19bb,Yeti Ariyani,https://play-lh.googleusercontent.com/a/ACg8ocI1_Bu5bQPqJPhIW4mad9H8j8sJieC80QGlAn2wC73b=mo,Sangat menyukai transportasi online,5,5,2.0.16,2021-03-19 21:20:16,"Hai Kak Yeti Ariyani, makasih ya atas rating dan reviewnya. Kami merasa senang bisa membantu dan memudahkan Anda. Nikmati beragam Promo dan Informasi terbaru dari Jogjakita. Apabila ada kendala silakan menghubungi melalui LiveChat/Call Center Jogjakita 08222-6657-999",2021-03-19 21:38:39,2.0.16
641f3820-1cf3-4580-b14f-4059a43f9e7e,fuad isbeny,https://play-lh.googleusercontent.com/a-/ALV-UjX_EmRJXGJg9SmkOeXCGXjymuS1MTAPT091OSQshB3oS80,joss poko'e,5,2,2.0.16,2021-03-19 21:15:34,"Hai Kak Fuad isbeny, makasih ya atas rating dan reviewnya. Kami merasa senang bisa membantu dan memudahkan Anda. Nikmati beragam Promo dan Informasi terbaru dari Jogjakita. Apabila ada kendala silakan menghubungi melalui LiveChat/Call Center Jogjakita 08222-6657-999",2021-03-19 21:38:01,2.0.16
82054b3e-ba1c-4469-9014-4c2962d194d8,Anjar Property,https://play-lh.googleusercontent.com/a/ACg8ocJYbf03k5rcdtuoXfgVxuxb2QucDyVfk6jQqS1_0uLq=mo,Mksh ya,5,2,2.0.16,2021-03-19 20:11:17,"Hai Kak Anjar , makasih ya atas rating dan reviewnya. Kami merasa senang bisa membantu dan memudahkan Anda. Nikmati beragam Promo dan Informasi terbaru dari Jogjakita. Apabila ada kendala silakan menghubungi melalui LiveChat/Call Center Jogjakita 08222-6657-999",2021-03-19 20:09:03,2.0.16
a693a640-9a97-47a4-a092-441be365e68d,Muninggar retno Utami,https://play-lh.googleusercontent.com/a/ACg8ocIRpNcbDqLjbhQ1B15KxfXpNaeJgG73wVPua1Lt3St1=mo,Tingkatkan lah buat ke arifan lokal,5,2,2.0.16,2021-03-19 18:57:15,"Hai kak Muninggar retno Utami, terimakasih atas rating dan reviewnya. Baik kak, kami akan terus meningkatkan layanan di JogjaKita, untuk Jogja tercinta. Yukk Ajak teman dan saudara install JogjaKita dan nikmatin promo #nengdiwaemangewu",2021-03-19 19:56:25,2.0.16
e660e296-e185-4da5-ab78-7c54dfcf00a7,adi nugroho,https://play-lh.googleusercontent.com/a-/ALV-UjXoAxOTTOjEDr2YHUEIMWWQ-S0MWRdKU0dTd8LVCNJoxtQ,Driver juga pengguna tidak ada komentar,5,2,2.0.16,2021-03-19 17:49:37,"Hai Kak adi , makasih atas rating dan reviewnya. Mohon maaf atas ketidaknyamanan Anda, silakan menginformasikan kendala Anda kepada tim CS kami melalui livechat/call center 082226657999 untuk dibantu solusikan kendala yang anda alami.",2021-03-19 20:07:09,2.0.16
1fdd6f97-a799-48d5-a0cf-60a97ab5abbf,HELEND NOVITA,https://play-lh.googleusercontent.com/a-/ALV-UjU2dwio_dsAQB5Kb0H6Yj-OtUdoMrInIQyk4TT5AYDlFg,"Tidak memuaskan, saya pesan makanan Sampek sekarang belum sampai dan tulisan di apknya orderan selesaii , padahal saya belum Nerima apapun",1,0,2.0.15,2021-03-19 16:52:25,"Hai Kak helend , makasih atas rating dan reviewnya. Mohon maaf atas ketidaknyamanan Anda, silakan menginformasikan kendala Anda kepada tim CS kami melalui livechat/call center 082226657999 untuk dibantu solusikan kendala yang anda alami.",2021-03-19 18:25:14,2.0.15
9eb37a36-a114-400c-aba6-bc96bb6cd2a4,Jacky nung,https://play-lh.googleusercontent.com/a-/ALV-UjUhTJaEF4DisibEa4iOenFANLLQ90cH-KXrVZMi4rpGhVo,Sangat membantu,5,2,2.0.16,2021-03-19 15:14:35,"Hai Kak Jacky, makasih ya atas rating dan reviewnya. Kami merasa senang bisa membantu dan memudahkan Anda. Nikmati beragam Promo dan Informasi terbaru dari Jogjakita. Apabila ada kendala silakan menghubungi melalui LiveChat/Call Center Jogjakita 08222-6657-999",2021-03-19 18:25:34,2.0.16
2b930a01-15e6-46f7-9aad-a3337bcba31b,belliaayu dewi,https://play-lh.googleusercontent.com/a/ACg8ocKWCadra1V2lShBjGmhYR3c8VdM-XBxP5C8i7KXEWiapA=mo,Hai jogja kita saya mau bertanya kok saya mau pesan antar failed terus kenapa ya tolong diperbaiki lagi,3,1,2.0.16,2021-03-19 14:13:49,Hai kak Belliaayu Dewi. terimakasih atas rating dan reviewnya. mohon pastikan koneksi internet yang di gunakan stabil ya kak atau bisa kirimkan screenshot ketika mengalami kendala tersebut ke email support@speedcash.co.id ya kak agar dapat kami lakukan pengecekan. Terimakasih.,2021-03-19 14:40:34,2.0.16
7ce0b74c-f8d4-453e-aab3-4ed70fbd72da,ana Muanas,https://play-lh.googleusercontent.com/a/ACg8ocIkc3h5yuppYb7L4lkebK0mJpPrR_nQWOB2fo9Oxfnz=mo,"Promo yang di berikan memang sangat bagus, tapi maaf saya kasih bintang 1, hari ini saya dicancel.driver 2 kali padahal sudah nunggu lama buat dapat driver setelah dapat dan driver sudah pick up, sudah balas chat dan bilang otw, bahkan sudah dekat tempat saya, tau2 driver cancel orderan tanpa info apapun,yg ke dua, order lagi, dapat driver, driver sudah dekat tau2 tlfon, bilang baterai habis, jadi di cancel, kenapa segampang itu,semiga kedepan nya lebih baik lagi",1,5,2.0.15,2021-03-19 12:54:53,"Hai kak Ana Muanas, mohon maaf atas ketidaknyamananya, kami akan terus melakukan perbaikan layanan di aplikasi JogjaKita. Apabila mengalami kendala aplikasi, bisa lho contact tim CS kami melalui livechat/call center 082226657999",2021-03-19 14:43:08,2.0.15
31d6cc36-90e5-41b6-b700-9fbe438c7f26,BERDRY LODRICA MIRU,https://play-lh.googleusercontent.com/a/ACg8ocJRSEljwf_jnOYrtpxGPI2vU1pOMY2_kJTXgfhCsaVu=mo,Ok,5,2,2.0.16,2021-03-19 12:18:09,"Hai kak BERDRY LODRICA MIRU, makasih atas rating dan review nya. Senang sekali dengan ulasan yang kakak berikan. Yukk Ajak teman dan saudara install aplikasi JogjaKita, nikmatin promo nengdi wae mangewu untuk pesan makan, belanja, kirim barang dan ojek motor. Jika ada kendala bisa lho contact tim CS kami melalui livechat/call center 082226657999",2021-03-19 14:45:27,2.0.16
f704bd42-e4ee-4a7a-ab37-33a05cb81700,Dekid's new,https://play-lh.googleusercontent.com/a/ACg8ocI3EOY2PhVfMweAI0mFhqKagrD1iSyMQAo4ZRKP0H6A=mo,"Tarif yg di dapat driver sangat sedikit, tdk sebanding resiko di jalan yg sangat besar",1,0,2.0.16,2021-03-19 09:31:22,Hai Kak Dekid's new. makasih ya atas rating dan reviewnya. Kami sangat mengapresiasi perhatian Anda kepada Jogjakita. Kami akan selalu berbenah dan berusaha memberikan yg terbaik untuk mitra kami. Apabila ada kendala silakan menghubungi melalui LiveChat/Call Center Jogjakita 08222-6657-999,2021-03-19 11:31:34,2.0.16
2d317c17-2e56-4ca3-8dce-7192e7261b41,Ragil Pujono,https://play-lh.googleusercontent.com/a-/ALV-UjWGKQsnanlHJnZwQYbTAeSBXcHhiRYMkcbbMxTEc5SEFyE,Aplikasi ringan,5,2,2.0.16,2021-03-19 08:44:57,"Hai Kak Ragil Pujono, makasih ya atas rating dan reviewnya. Kami merasa senang bisa membantu dan memudahkan Anda. Nikmati beragam Promo dan Informasi terbaru dari Jogjakita. Apabila ada kendala silakan menghubungi melalui LiveChat/Call Center Jogjakita 08222-6657-999",2021-03-19 11:08:25,2.0.16
904b716f-bb18-4c95-bff4-48b99d3df2bb,minarti larasati,https://play-lh.googleusercontent.com/a-/ALV-UjWLlY_S5xZg6fCDtN0WDHgsJ9JL49qYOMbeVaVEbDe9YA,"Wow...luar biasa ""pelayanan"" bagus yang ditawarkan..!!! Dan sangat ""terbantu"" dalam sikon Pandemic ini. Harga pun MurMer...😁😍👍🙏 Maju teruuuus JogjaKita..Jayalah ..!!! Aamiin³...",5,3,2.0.16,2021-03-19 02:37:21,"Hai kak Minarti Larasati, terimakasih atas rating dan review nya. kami merasa senang sekali bisa membantu anda. Yukk ajak teman dan saudara install JogjaKita dan nikmatin promo nengdi wae mangewunya. Apabila mengalami kendala aplikasi, bisa lho contact tim CS kami melalui livechat/call center 082226657999",2021-03-19 11:03:37,2.0.16
9619c8fb-38bb-44df-885b-597a9422e2ed,Slamet Raharjo,https://play-lh.googleusercontent.com/a/ACg8ocKXyvYbsh8bUxGIs1UXttSXp_TOPVDsCGR1Tl3E9ROy=mo,"Buat yg kasih bintang satu ""bego jgn dipelihara..mau dpt promo tanya dl syarat & ketentuany..jgn asal nyerocos ini aplikasi baru lahir harusnya kalian dukung...",5,4,2.0.16,2021-03-18 22:35:52,"Hai kak Slame Raharjo. terimakasih atas ulasan yang kakak berikan, warga Asli Jogja pasti mendukung aplikasi JogjaKita, Yukk ajak saudara dan teman install Aplikasi JogjaKita dan nikmatin berbagai promo nengdi wae mangewu bisa untuk pesan makan, kirim barang, belanja dan ojek motor keliling Jogja.",2021-03-19 10:42:32,2.0.16
2374ff28-691f-46d5-9dfb-a4288ad91139,dwi pugianto,https://play-lh.googleusercontent.com/a-/ALV-UjWd4ZRw-uysp3v6FIgio-auc1IAA3oqn8FPUw-4CtDcGYY,"MAP nya susah bener,semoga cepat diperbaiki",2,0,2.0.16,2021-03-18 19:53:14,"Hai Kak dwi pugianto, makasih atas rating dan reviewnya. Kami akan menjadikan ini sebagai masukan untuk pengembangan produk kami selanjutnya. Jogjakita akan terus berusaha melengkapi dan meningkatkan layanan untuk pelanggan setia seperti Anda. Jika ada kendala bisa lho contact tim CS kami melalui livechat/call center 082226657999",2021-03-18 20:06:36,2.0.16
5b21980c-5bf9-42d6-8df6-b1d7c5fa626f,Story Wa,https://play-lh.googleusercontent.com/a-/ALV-UjV6EJji1K7Ep31CFhrxEdUDNld0iusEVNW8NuSw34r7sw,Aplikasinya real banget cuman bingung aja sama lokasi nya kadang kadang sesuai di titik penjemputan kadang enggak selebihnya itu okee banget lah berkembang terus ya,4,3,,2021-03-18 18:49:01,"Hai Kak Story Wa, makasih atas rating dan reviewnya. Kami akan menjadikan ini sebagai masukan untuk pengembangan produk kami selanjutnya. Jogjakita akan terus berusaha melengkapi dan meningkatkan layanan untuk pelanggan setia seperti Anda. Jika ada kendala bisa lho contact tim CS kami melalui livechat/call center 082226657999",2021-03-18 20:06:18,
f91333ca-e0a3-4780-9ce0-c95631d8ecc8,wahyu ngamplah,https://play-lh.googleusercontent.com/a-/ALV-UjVhz_x9Nxe1_t0oeW2TaHjtvULWiFwiuJeiT0T7NjPJEuw,Aplikasinya blm ad menu cancel dan drivernya tidak ramah dan sopan,3,1,,2021-03-18 17:31:43,"Hai kak Wahyu Ngamplah, makasih ya atas rating dan reviewnya. kami akan terus melakukan perbaikan di aplikasi dan layanan JogjaKita. untuk keluhan pelayanan Driver, silahkan memberikan rating di aplikasi ketika order terselesaikan kak. Apabila ada kendala silakan menghubungi melalui LiveChat/Call Center Jogjakita 08222-6657-999.",2021-03-18 17:57:39,
73a47924-a0cb-4cef-86a1-e2c065697346,Sudar Yanto,https://play-lh.googleusercontent.com/a/ACg8ocIrKyyVFA_vzdWLT-oU9VicoBcjLqO39xVqIFD0HikH=mo,Mantap,5,2,,2021-03-18 12:16:41,"Hai Kak Sudar , makasih atas rating dan reviewnya. Jogjakita emang mantap gitu, lebih mantap lagi kalo kamu bisa ajakin teman dan keluarga buat join Jogjakita juga lho. Nikmati juga promo-promo yang ada di Jogjakita. Kalo ada kendala jangan sungkan buat hubungi CS kami yang siaga 24jam via livechat/call center 082226657999",2021-03-18 13:24:19,
2316ea3e-5165-47ad-975b-4e3dd53485b6,Hartono,https://play-lh.googleusercontent.com/a-/ALV-UjVZd6Cz9lbM6xta6urdmYKdi4sLk4kDf_Gq296ecDLCwg,Baik,5,2,,2021-03-18 12:14:41,"Hai Kak Hartono, makasih ya atas rating dan reviewnya. Jangan lupa ajakin teman dan keluarga Anda biar menggunakan Jogjakita dan dapatkan promo menarik tiap minggunya. Jika ada kendala bisa lho contact tim CS kami melalui livechat/call center 082226657999",2021-03-18 13:24:32,
9cc00424-a842-4b4d-a4e1-f74c0274754d,Agus Fajar,https://play-lh.googleusercontent.com/a-/ALV-UjU3BD9gP5nY6Zwm7ZNyz0JH4WwExzIc1Jv2PSrx0x7aors,Banggalah warga jogja klao jogja sdh punyak gojek sendiri.mari pakai gojek asli jogja....monggo,5,2,2.0.16,2021-03-17 20:09:38,"Hai Kak Agus, makasih atas rating dan reviewnya. Selamat bergabung di Jogjakita. Semoga dengan layanan Jogjakita dapat membantu kemudahan Anda dalam bertransaksi. Nikmati juga beragam promo dan info terbaru dari Jogjakita tiap bulannya.",2021-03-17 22:02:30,2.0.16
dbcc02ae-beb1-4c18-b90a-6332c48139be,Ratih Istikhomah,https://play-lh.googleusercontent.com/a-/ALV-UjX9qmxE5R7ZrhbzxmO22gr1BXl1mBqW1ajX4AJweiGt_Q,"promo yg ditawarkan sangat membantu sekali. Sayangnya,setiap kali saya ordr,proses pencarian driver nya lama sekali. Bisa smpe 5 menit kadang. Padahal saya ada di pusat kota. Trs kalay boleh, di aplks punya driver nya dikash pesan otomats gt. Mohon ditunggu/ apalah. Soalnya semua chat manual. Saya dlm pengalaman 2 bulan ini dpt driver yg kayak cuman ngecat sesama teman. Malah ada yg bilang suruh nunggu dulu lagi ganti celana. Ky gt kan kurang sopan. Mohon dtngkatkan playanan utk lbh baik lg ya.",3,10,2.0.16,2021-03-17 17:18:33,"Hai Kak Ratih, makasih atas rating dan reviewnya. Kami akan menjadikan ini sebagai masukan untuk pengembangan produk kami selanjutnya. Jogjakita akan terus berusaha melengkapi dan meningkatkan layanan untuk pelanggan setia seperti Anda. Jika ada kendala bisa lho contact tim CS kami melalui livechat/call center 082226657999",2021-03-17 19:51:34,2.0.16
7551e37d-a253-42bb-bb18-7c87a425dbb0,Mujiyat “MJT88067” Mujiyat,https://play-lh.googleusercontent.com/a-/ALV-UjUhRI21vjuFJTpkmobiIRFUxMH4LfaV15CmkueXGHLu2g,Kurang familier untuk digunakan... Tolong perbaiki secepatnya...,3,1,,2021-03-17 14:54:31,"Hai Kak Albani , makasih atas rating dan reviewnya. Semoga dengan adanya Jogjakita, kamu mendapatkan kemudahan bertransaksi dan mendapatkan pundi-pundi bisnis yang melimpah. Yuk kepoin beragam promo dan kuis via media sosial kami ya. Kalo ada kendala bisa lho contact tim CS kami melalui livechat/call center 082226657999",2021-03-17 19:53:16,
0cc5a8f7-4b35-415b-b8d8-34df82e0c98d,Matthew linky,https://play-lh.googleusercontent.com/a-/ALV-UjU03jOW9hgcntE91HsvSww8I2lghKQ4v1hZPrv8r0rIk08g,"Gmna ceritanya daftar gak bisa bisa , download buat jadi customer kok mlah di blokir 😂,",1,0,,2021-03-17 14:13:19,"Hai Kak rezky , makasih atas rating dan reviewnya. Mohon maaf atas ketidaknyamanan Anda, silakan menginformasikan kendala Anda kepada tim CS kami melalui livechat/call center 082226657999 untuk dibantu solusikan kendala yang anda alami.",2021-03-17 19:56:15,
88178589-3782-45a8-a97c-2a0468ce0756,Toat Widada,https://play-lh.googleusercontent.com/a/ACg8ocLIQdG2J6cDgmBVtaB5fNtoQR1uUP8MlR3r5DMAS2ji=mo,Kak tolong diperbaiki selama naik jogjakita kok drivernya pakai atribut ojol ijo ya kak...tolong kasih suspend atau suruh pakai atribut jogjakita pas dia menjalankan jogjakita ...trimakasih,5,2,,2021-03-17 12:22:39,"Hai Kak Toat , makasih atas rating dan reviewnya. Mohon maaf atas ketidaknyamanan Anda. Untuk jaket Jogjakita saat ini masih dalam proses pendistribusian ke driver. Jadi kedepannya untuk atribut jaket wajib digunakan jika driver sudah mendapatkan atribut. Jika ada kendala bisa lho contact tim CS kami melalui livechat/call center 082226657999",2021-03-17 20:02:28,
4ac97704-3875-4364-b292-6fa3aff5dd87,Fitria Ningsih,https://play-lh.googleusercontent.com/a-/ALV-UjV0kq46dhlnIsDkq-O-uhtC9hOH0XvnKCFNzN2nndysSA,"Terjangkau banget tarif nya cocok banget buat kalangan yg duitnya lg nipis dan juga pelajar , mahasiswa. Minusnya cuma 1 lemot jpsnya terlalu lama. Tp semuanya bagus",5,7,,2021-03-17 12:22:23,"Hai Kak Fitria , makasih ya atas rating dan reviewnya. Jangan lupa ajakin teman dan keluarga Anda biar menggunakan Jogjakita dan dapatkan promo menarik tiap minggunya. Jika ada kendala bisa lho contact tim CS kami melalui livechat/call center 082226657999",2021-03-17 20:02:56,
e86586a8-b5ab-4b99-b22f-d9c2aa78898e,Rendy Setiawan,https://play-lh.googleusercontent.com/a-/ALV-UjVvQFOgIQSAJpPfzV_o79Hg9zEIYF7_tfZOphPSg3zI8Rk,Bagus,5,2,2.0.16,2021-03-17 10:25:57,"Hai Kak Rendy , makasih ya atas rating dan reviewnya. Jangan lupa ajakin teman dan keluarga Anda biar menggunakan Jogjakita dan dapatkan promo menarik tiap minggunya. Jika ada kendala bisa lho contact tim CS kami melalui livechat/call center 082226657999",2021-03-17 20:06:59,2.0.16
5a3cb61b-e08b-49e6-b605-568661a81064,bukan keenan,https://play-lh.googleusercontent.com/a/ACg8ocICE_MNhKA7GI87Ybbxs7l9o_rF0eJJ7JzQ1SlwYCiB=mo,Bagus. Majukan jogja kita,5,2,2.0.16,2021-03-17 09:36:51,"Hai kak Bukan Keenan, Terimakasih atas rating dan reviewnya, makasih atas rating dan reviewnya. Selamat bergabung di Jogjakita. Semoga dengan layanan Jogjakita dapat membantu kemudahan Anda dalam bertransaksi. Nikmati juga beragam promo dan info terbaru dari Jogjakita tiap bulannya.",2021-03-17 10:27:52,2.0.16
dae49b3c-3bb3-4299-8886-6ca713a467a1,Samsul Driver,https://play-lh.googleusercontent.com/a-/ALV-UjWHxIFkMnib1zLzVq9JgwoUp1aYwq85cA5IUWKwfmlisKs,Jogja yes,5,2,,2021-03-17 08:24:02,"Hai kak Samsul Driver, makasih atas rating dan reviewnya. iya kak JogjaKita aplikasi asli dari jogja untuk warga jogja. nikmatin berbagai kemudahan di aplikasi JogjaKita bisa pesan makan, belanja barang, kirim barang dan ojek motor. Yukk Ajak teman dan saudara install JogjaKita, masih ada promo gratis ongkir pesan makan di merchant favorit.",2021-03-17 09:17:36,
ccf07b69-677c-41fc-8f19-a9286ae0690f,Rifka Purnama Aji,https://play-lh.googleusercontent.com/a-/ALV-UjWm4UYMK0DB0mww6LrIBC5UBaOIC-JGn0oX05zwkFHVPb8,Perpanjangan promo sampai lebaran biar bisa membantu saat cari makanan buat berbuka maupun sahur baru bintang 5..,3,1,2.0.16,2021-03-16 23:30:35,"Hai Kak Rifka , makasih atas rating dan reviewnya. Kami akan menjadikan ini sebagai masukan untuk pengembangan produk kami selanjutnya. Jogjakita akan terus berusaha melengkapi dan meningkatkan layanan untuk pelanggan setia seperti Anda. Jika ada kendala bisa lho contact tim CS kami melalui livechat/call center 082226657999",2021-03-17 02:07:38,2.0.16
7fae5d3f-327f-4606-8250-e9bb64e91250,Swasti Octaviana,https://play-lh.googleusercontent.com/a/ACg8ocI15V2bNownWRh_AxpB12wOky2Rh1B383CmDg1g_Mcu=mo,aplikasi nya bagus banget saya suka dengan aplikasi ini sangat membantu saya semoga jogja kita makin jaya terus,5,9,2.0.16,2021-03-16 23:24:47,"Hai Kak Swasti , makasih ya atas rating dan reviewnya. Kami merasa senang bisa membantu dan memudahkan Anda. Nikmati beragam Promo dan Informasi terbaru dari Jogjakita. Apabila ada kendala silakan menghubungi melalui LiveChat/Call Center Jogjakita 08222-6657-999",2021-03-17 02:07:23,2.0.16
b0adfacc-557f-4149-a168-7add87fff121,Santosa Roni,https://play-lh.googleusercontent.com/a/ACg8ocLRbTV257-fXH_t9NTypwEigektqDJNtHect7jlYHaN=mo,Aplikasi apaan ini mau pesen jogja send udah alamat pengiriman gak bisa diedit pembayaran juga gak bisa diedit dan akhirnya tombol pemesanan gak bisa diklik,5,9,2.0.15,2021-03-16 21:15:44,"Hai Kak Santosa Roni.mohon maaf untuk ketidaknyamannya ,silahkan bisa dilakukan logout login akunnya ya kak,jika masih terkendala silakan menghubungi melalui LiveChat/Call Center Jogjakita 08222-6657-999,Sukses selalu :)",2021-03-03 02:48:27,2.0.15
16988b59-46ea-45a0-85f2-0638d3640463,Triwandiyah Ningrum,https://play-lh.googleusercontent.com/a-/ALV-UjXmxWf8Wi31VBQlufHlr4_pG3fOR0kd6SWqGWgrE9_gRw,Bagus bgt,5,2,,2021-03-16 20:44:44,"Hai Kak Triwandiyah , makasih atas rating dan reviewnya. Selamat bergabung di Jogjakita. Semoga dengan layanan Jogjakita dapat membantu kemudahan Anda dalam bertransaksi. Nikmati juga beragam promo dan info terbaru dari Jogjakita tiap bulannya.",2021-03-17 02:07:09,
305f4364-a592-42ad-ac76-f20ca158fd29,Resita Saputri,https://play-lh.googleusercontent.com/a-/ALV-UjWVrYf8j50FyhYvMVbyLMM2NsZYzOzJ_gg50oq3sQ_60Q,Apa masih ada Promo ?,5,2,,2021-03-16 20:12:43,"Hai Kak Resita , makasih ya buat rating dan reviewnya. Untuk promo nengdiwaemangewu diperpanjang sampai bulan Maret dan 1 pengguna maksimal 3x dalam sehari ya. Apabila ada kendala silakan menghubungi melalui LiveChat/Call Center Jogjakita 08222-6657-999",2021-03-17 02:06:56,
ba92ef59-0cfb-4554-8e9c-f2d31c4ce9d4,Bukit Digital,https://play-lh.googleusercontent.com/a-/ALV-UjVV8puaSlf3UUtrbg-ssG1rBm0Hc8j7CxQ43sEiXsc6HNI,"Min admin aplikasi di perbarui lagi solanya sudah semakin banyak penggunanya, soalny udah 2 hari aplikasi jogjakita saya gak bisa dibuka menyiapkan akun melulu gak kelar2, udah logout login mene podo wae hasile. Tetap kasih bintang 5 deh",5,8,2.0.16,2021-03-16 18:55:33,"Hai Kak Ngerayau , makasih atas rating dan reviewnya. Kami akan menjadikan ini sebagai masukan untuk pengembangan produk kami selanjutnya. Jogjakita akan terus berusaha melengkapi dan meningkatkan layanan untuk pelanggan setia seperti Anda. Jika ada kendala bisa lho contact tim CS kami melalui livechat/call center 082226657999",2021-03-17 02:06:39,2.0.16
0d537bd3-211e-4032-b1e2-94dd03f2f6fa,Endang Lestari,https://play-lh.googleusercontent.com/a/ACg8ocIrQ0cjafwLd5V6idygYhxxVuPKdk15ZRL2mUBhxGGJ=mo,Jooosss,5,2,2.0.16,2021-03-16 17:55:37,"Hai Kak Dwi Waluyo, makasih atas rating dan reviewnya.Yukk ajak teman dan saudara install Jogjakita dan nikmati juga promo-promo yang ada di Jogjakita. Kalo ada kendala jangan sungkan buat hubungi CS kami yang siaga 24jam via livechat/call center 082226657999",2021-03-16 18:36:37,2.0.16
f96fd737-dba4-459b-9d66-5432ab8a52b2,Enny Swan,https://play-lh.googleusercontent.com/a-/ALV-UjXdh6amxyK09sXZqti1NaDARkCpWvTFbwHxEJ2qmTdTQmU5,"Wah aplikasi yang bagus..tingkatkan terus ya..tarif murah baru pertama coba..namun fitur chat masih bug sepertinya,dan untuk melihat track masih delay..semakin ditingkatkan ya kedepannya..good job..",5,12,2.0.16,2021-03-16 17:15:34,"Hai Kak Enny Swan, terimakasih atas rating dan reviewnya. kami akan melakukan perbaikan di update aplikasi selanjutnya. Yukk ajak saudara dan teman install aplikasi JogjaKita dan nikmatin promo nengdi wae mangewu nya.",2021-03-16 17:33:58,2.0.16
8dfcead0-294b-41ce-a52e-c7800a72523d,dika Kalista,https://play-lh.googleusercontent.com/a-/ALV-UjVGY707wiIXQQ6tlq7pllUj0ZDEsOl3gFywnzpEpiXnKkM,"Tolong ya JOGJA KITA. kalo ada driver yg belom punya seragam . Tolong bgt ya. Jangan sekali kali diperbolehkan online standby siap mengantarkan pelanggan. TLG BGT BGT BANGETTTT.... Pengalaman saya baru pertama kali coba aplikasi ini. Baru prtama kali aja lgsg dpt driver tdk berjaket. Bukan apa2. Cuma diliat org kan bukan sama ojek 😑😑😑😑 mau cancel gakbisa, dijalan nyesegggg terussss gue 🤬🤬🤬🤬🤬🤬🤬🤬🤬",1,0,2.0.16,2021-03-16 16:26:01,"Hai kak Dika Kalista, mohon maaf atas ketidaknyamanannya, kami akan terus melakukan perbaikan pelayanan kepada pelanggan setia Jogjakita. untuk saran dan masukan bisa kakak sampaikan via live chat dari aplikasi JogjaKita pada menu bantuan atau call center JogjaKita di nomor telepon 08222-6657-999. Terimakasih",2021-03-16 17:04:43,2.0.16
df6fa9a2-120f-4586-82c6-4fde4b65ffb1,Priyo Prasetyo,https://play-lh.googleusercontent.com/a-/ALV-UjVYdKO1d9hj7Q5wc69lezn_pt_JC8i4Zqwcl65YlwVYokM,Yolong diperbaiki selalu dapat driver yg jauh saat buru buru bikin repot,2,0,2.0.16,2021-03-16 15:55:30,"Hai Kak Priyo Prasetyo, terimakasih atas rating dan reviewnya, kami akan terus melakukan perbaikan untuk sebaran driver kami dan layanan aplikasi JogjaKita. Apabila mengalami kendala silahkan kontak kami dari menu bantuan di aplikasi atau call center JogjaKita di nomor 08222-6657-999. Terimakasih",2021-03-16 16:35:26,2.0.16
7f454752-5a05-4dc0-996a-503b901bfe94,Elga Fiana,https://play-lh.googleusercontent.com/a/ACg8ocI6i56X6lwQ08oNtBrId7Jfl3-8SwQi8eWmZD_Skdym=mo,"Selama oakai jogja kita saya suka dgn tarif yg sangat membantu di saat pandemi saat ini ,namun terkdng jika da pembaharuan keluar sndri ,dan dua hari ini susah masuk ke aplkasinya , mohjn untuk lbh di perbaiki lagi sistemnya trmkash",4,2,2.0.16,2021-03-16 15:05:09,"Hai kak Elga Fiana, makasi atas rating dan reviewnya. untuk kendala tersebut mohon pastikan koneksi internet yang akak gunakan stabil ya. kami akan terus melakukan perbaikan aplikasi dan layanan JogjaKita. jika ada kendala silahkan kontak kami dari menu bantuan di aplikasi atau call center Jogjakita di nomor 08222-6657-999. Terima kasih",2021-03-16 16:20:08,2.0.16
7c36afc5-9e1f-4ed8-8195-d25812cb30a9,Mr. Kreatif,https://play-lh.googleusercontent.com/a-/ALV-UjW2H7CNB2fdTem4IlDbbH_VaLyWsokulAg8LgcoLVb0Jr8,Semoga lebih maju dan bermanfaat untuk semua orang terutama jogja istimewa,5,3,2.0.16,2021-03-16 12:40:20,"Hai Kak Mr. Kreatif , makasih ya atas rating dan reviewnya. Kami merasa senang bisa membantu dan memudahkan Anda. Nikmati beragam Promo dan Informasi terbaru dari Jogjakita. Apabila ada kendala silakan menghubungi melalui LiveChat/Call Center Jogjakita 08222-6657-999",2021-03-16 13:24:00,2.0.16
b7a58067-4aeb-4290-a54a-f3d8748f9d36,Agus Tri,https://play-lh.googleusercontent.com/a/ACg8ocIk6XUTlKOVYRgD6IDrYzjKDIVq6CmyS2YQ14tbD-Xc=mo,Saya suka,5,2,,2021-03-16 10:58:35,"Hai Kak Agus Tri, makasih ya atas rating dan reviewnya. Kami merasa senang bisa membantu dan memudahkan Anda. Nikmati beragam Promo dan Informasi terbaru dari Jogjakita. Apabila ada kendala silakan menghubungi melalui LiveChat/Call Center Jogjakita 08222-6657-999",2021-03-16 11:23:59,
