reviewId,userName,userImage,content,score,thumbsUpCount,reviewCreatedVersion,at,replyContent,repliedAt,appVersion
e84f9b7c-88f6-49c9-9466-75c37ddf53c9,Madia Beda,https://play-lh.googleusercontent.com/a-/ALV-UjUrCU2BzfN4Qyd40coo354OVuDfA8rSBGRu3P91X5pX1BEqTImO,Mantul,3,0,3.1.8,2022-11-09 22:35:36,"Terimakasih untuk Rating dan Ulasannya ya kak, Semoga selalu setia menggunakan layanan JogjaKita. Jika ada kendala silahkan menghubungi Admin JogjaKita via Direct Message Instagram @jogjakita_official. Terimakasih",2022-11-10 09:16:31,3.1.8
29691933-e4c4-4790-8056-925ac52feafe,Sullivan Anjar,https://play-lh.googleusercontent.com/a/ACg8ocLXn1jUQ_Oll0D_Buw3XdgHgosoj9OgHF_lR_Uzeo9SrIueAw=mo,"Klo ada yg suruh daftar pake link orng trsebut... Jngn mau.. Itu penipun,, orng trsebutlah yg dpt 70k",1,0,,2022-11-09 16:11:04,"Hay kak Sullivan Anjar, Benar... JogjaKita sedang ada program ajak teman untuk Daftar Driver, namun jika tidak berkenan kamu bisa langsung Daftar ke kantor JogjaKita atau langsung mendaftar secara MANDIRI via Aplikasi Driver JogjaKita. Selamat beraktivitas :)",2022-11-10 09:16:11,
e007fe14-4eed-4fa7-ab53-461ea1e01f5a,aris slamet widodo,https://play-lh.googleusercontent.com/a-/ALV-UjXVJD0mLkY-IOhCGk3fKzF6m19MAgLkHsQuKXux7Bfl7WNpQJWi,Jos,5,2,3.1.8,2022-11-07 10:13:23,"Terimakasih untuk Rating dan Ulasannya ya kak, Semoga selalu setia menggunakan layanan JogjaKita. Jika ada kendala silahkan menghubungi Admin JogjaKita via Direct Message Instagram @jogjakita_official. Terimakasih",2022-11-08 09:21:08,3.1.8
a74116f6-107d-473c-82f0-bddc97cb39d7,Rudhy Ansyah,https://play-lh.googleusercontent.com/a-/ALV-UjU6vVJWqYxb2QiU2R2CgWNvg9MgwHFdHAacOlIciz7K1XqB4xDv,Bgus apk nya seneng sy sangat membantu,5,4,3.1.8,2022-11-06 22:13:44,"Terimakasih untuk Rating dan Ulasannya ya kak, Semoga selalu setia menggunakan layanan JogjaKita. Jika ada kendala silahkan menghubungi Admin JogjaKita via Direct Message Instagram @jogjakita_official. Terimakasih",2022-11-07 09:10:12,3.1.8
655aeaa6-3b5a-441e-a53f-767c766384c4,G0fIE (Fendi),https://play-lh.googleusercontent.com/a-/ALV-UjVMEm89rEcfc5gKAM2Y2_rDwK39G5R_1nGxPABgjk5eepczXlrAUA,murah meriah,5,2,3.1.8,2022-11-06 15:43:28,"Terimakasih untuk Rating dan Ulasannya ya kak, Semoga selalu setia menggunakan layanan JogjaKita. Jika ada kendala silahkan menghubungi Admin JogjaKita via Direct Message Instagram @jogjakita_official. Terimakasih",2022-11-07 09:10:19,3.1.8
2ef0f89a-daad-4e66-99e0-0aceff093560,Suwar Sih,https://play-lh.googleusercontent.com/a/ACg8ocJldsohaVYhaw7U_5PjDpjGFbwUS1fasKyuIZ9zUnPk05MoIw=mo,sangat membantu terimakasih pak,5,2,3.1.8,2022-11-06 09:35:36,"Terimakasih untuk Rating dan Ulasannya ya kak, Semoga selalu setia menggunakan layanan JogjaKita. Jika ada kendala silahkan menghubungi Admin JogjaKita via Direct Message Instagram @jogjakita_official. Terimakasih",2022-11-07 09:10:24,3.1.8
a8016102-ce4b-4332-b43a-59ff43612ac8,Yady Noer,https://play-lh.googleusercontent.com/a/ACg8ocJOtr5gLvMaLmRPYXbxt4knBhj6RSxkxVRH6dj72XOcB3jGSg=mo,top,5,2,3.1.7,2022-11-06 04:35:25,"Terimakasih untuk Rating dan Ulasannya ya kak, Semoga selalu setia menggunakan layanan JogjaKita. Jika ada kendala silahkan menghubungi Admin JogjaKita via Direct Message Instagram @jogjakita_official. Terimakasih",2022-11-07 09:10:30,3.1.7
28ac2176-4ec9-4324-94c1-34f8556af497,Bhetrix,https://play-lh.googleusercontent.com/a-/ALV-UjXDU1-LHQpSayCuOoe5qJr3kqE6MqcVqKvVkcpmJ_GPAKN3noXV,"APK aneh, masa gw gak bisa daftar",1,0,3.1.8,2022-11-05 17:47:31,"Hallo kak, Mohon maaf untuk ketidaknyamanannya. Perihal tersebut mohon infokan detail kendalanya ya, silahkan menghubungi Admin JogjaKita via Direct Message Instagram @jogjakita_official. Kami akan membantu hingga tuntas. Terimakasih",2022-11-07 09:09:48,3.1.8
ef0118d7-1d42-4f4d-8b82-40d134605caf,Rosita Suryaningwidi,https://play-lh.googleusercontent.com/a-/ALV-UjXguT40sI33JQSeH5KTS1H_SfxzRY8iz9dQOr2nbavv7Xnfecmg,Mau registrasi susahnya minta ampun,2,0,3.1.8,2022-11-04 17:13:20,"Hallo kak, Mohon maaf untuk ketidaknyamanannya. Perihal tersebut mohon infokan detail kendalanya ya, silahkan menghubungi Admin JogjaKita via Direct Message Instagram @jogjakita_official. Kami akan membantu hingga tuntas. Terimakasih",2022-11-05 09:14:26,3.1.8
f53cd91c-bd75-4228-9d08-5928c84f08a0,Detrie Kania,https://play-lh.googleusercontent.com/a/ACg8ocIY0cuURXI2V13xfaB0ft4ZbaTO9AKNrZ_Na_KIoa57XcNjRg=mo,"drivernya selalu lelet, kalo harga nya memang paling murah, tpi Driver nya sangat lelet",2,0,3.1.8,2022-11-04 11:22:04,"Hallo kak, Mohon maaf untuk ketidaknyamanannya. Perihal tersebut kakak bisa langsung melaporkan terkait dengan attitude Driver, agar dapat kami bantu tindak dengan tegas ybs. Silahkan menghubungi Admin JogjaKita via Direct Message Instagram @jogjakita_official. Kami akan membantu hingga tuntas. Terimakasih",2022-11-05 09:15:59,3.1.8
920f5e72-ac65-4384-b474-d675717c8856,Heri Setiyo Nugroho,https://play-lh.googleusercontent.com/a-/ALV-UjX1Vi9Mt-S39pitxuzjDjB8RU0JpSejLBYgrj0o2NxWyWvrFsDw6w,Pengguna hp bisa memesan naik ojek Jogja kita. Semoga perjalanan lancar dan selamat. Mantap,5,4,3.1.8,2022-11-04 04:54:24,"Terimakasih untuk Rating dan Ulasannya ya kak, Semoga selalu setia menggunakan layanan JogjaKita. Jika ada kendala silahkan menghubungi Admin JogjaKita via Direct Message Instagram @jogjakita_official. Terimakasih",2022-11-04 12:33:17,3.1.8
6562e038-8ab9-4227-b34f-0cae12ff6100,Rukun Karunia Karunia Jaya,https://play-lh.googleusercontent.com/a-/ALV-UjXMLXHF4Au3kSjhQFsSu8AiJCl2Kbsr1BXUP4IgLnausozMwu6inw,bagus pelayanan dan driver ramah,5,5,3.1.7,2022-11-02 07:54:06,"Terimakasih untuk Rating dan Ulasannya ya kak, Semoga selalu setia menggunakan layanan JogjaKita. Jika ada kendala silahkan menghubungi Admin JogjaKita via Direct Message Instagram @jogjakita_official. Terimakasih",2022-11-03 15:12:21,3.1.7
63d21379-c50e-46e5-9e5d-d9a410a6f4f5,Hilarius Wisyudana putra,https://play-lh.googleusercontent.com/a-/ALV-UjV7wmXbFGrymGXDS7sTYsVaqrafMZUIt2hjURfwSrnB6MZ6UY-0,Wahhhh bagus banget aplikasinya,5,2,,2022-11-01 23:04:26,makasih ya atas rating dan reviewnya. Mohon maaf atas kendala yang dialami. akan kami tingkatkan kembali kedepannya kak :),2022-10-17 09:22:55,
4fe00be8-439d-42eb-a3e5-4848aa9bb603,Irvan Bahdim,https://play-lh.googleusercontent.com/a/ACg8ocK_AnNzs6KMWty2GlauD4CwVDZSBnfAVbYXOUD3WFA4a8sByg=mo,"APLIKASI SAMPAHH,GA BISA DAFTAR",1,0,3.1.8,2022-11-01 02:24:10,"Hallo kak, Mohon maaf untuk ketidaknyamanannya. Perihal tersebut mohon infokan detail kendalanya ya, silahkan menghubungi Admin JogjaKita via Direct Message Instagram @jogjakita_official. Kami akan membantu hingga tuntas. Terimakasih",2022-11-03 15:14:08,3.1.8
4f317943-9a95-436f-8932-6cc1b5100f77,Sekar Linestri,https://play-lh.googleusercontent.com/a/ACg8ocK7s51HXFRJivZi4tiwaGwrTsB2T7-cJf1xsh3ZMQ8YP4k8UA=mo,driver syulitt,3,0,3.1.5,2022-10-31 16:24:05,"Hallo kak, Mohon maaf untuk ketidaknyamanannya. Perihal tersebut mohon infokan detail lokasi pemesanan ya kak, sebagai evaluasi kami untuk pengadaan driver di wilayah tersebut. Terimakasih sudah menggunakan Jogjakita :)",2022-11-03 15:15:39,3.1.5
140408a6-48b6-4653-89f4-d3b0dfc4dcdc,D,https://play-lh.googleusercontent.com/a/ACg8ocKd788dzQYnmE1jo9IDgLJcnojFQoF4v8koHvWVBy5sQNcUeDs=mo,Mau daftar baru bisa besoknya setelah percobaan yang kedua.,3,0,,2022-10-31 15:15:15,makasih ya atas rating dan reviewnya. Mohon maaf atas kendala yang dialami. akan kami tingkatkan kembali kedepannya kak :),2022-10-31 14:32:27,
135c92fc-39bb-48bc-b4d4-4c3654b66bc2,Kipas Angin,https://play-lh.googleusercontent.com/a/ACg8ocIkad1rKr9QNct--R4ug4WRtslPWu1tffa34nFvSUtQYU8UeQ=mo,Ga jelas login gk bisa,1,0,,2022-10-31 12:10:16,makasih ya atas rating dan reviewnya. Mohon maaf atas kendala yang dialami. akan kami tingkatkan kembali kedepannya kak :),2022-10-31 14:32:34,
02806d61-7b0c-4797-94ee-26f69531b368,Ivana Astuti,https://play-lh.googleusercontent.com/a-/ALV-UjUBdef0CsYxU6sQoz39NZO5uykqgT0fu_vauxfpjSk1SRFoIyE,pertama kali pakai aplikasi ini mengecewakan. tulisan ada promo tapi sampai warung malah harga sesuai warung. parah! itu namanya membohongi customer. ga lagi pakai ini.,1,9,3.1.7,2022-10-31 10:26:49,makasih ya atas rating dan reviewnya. Mohon maaf atas kendala yang dialami. akan kami tingkatkan kembali kedepannya kak :),2022-10-31 14:32:32,3.1.7
6c01544c-a97c-467a-bba9-2613164325f4,Salsabila Sri Mulyani,https://play-lh.googleusercontent.com/a-/ALV-UjUjLyXucn5gFR51T2eE65GSBvbEHJe7019eiZwMAVUAR6orDUPN,ini kok driver nya lama bnget...sih...bisa2 2 jam sy nunggu inih...hadehhh,3,1,3.1.8,2022-10-31 07:14:22,makasih ya atas rating dan reviewnya. Mohon maaf atas kendala yang dialami. akan kami tingkatkan kembali kedepannya kak :),2022-10-31 14:32:30,3.1.8
358e85d9-61cf-454c-878a-9072dfa0593e,Asty Candylight Pamistriharani,https://play-lh.googleusercontent.com/a-/ALV-UjWDAjbvKDtgRQ__lrrQ73uucmVZP-ih__CklqZzP1zjZZ8vk58,"Aplikasi macam apa? Kalau belum sistem belum ready mending jangan launching dulu deh. Saya beli paket data lewat aplikasi JogjaKita dari tanggal 24 Oktober 2022 sampai sekarang belum ada masuk juga. Saya mau komplain via email tapi nggak pernah terkirim selalu gagal, entah mungkin alamat emailnya nggak bener atau gimana. Saya mau komplain via live chat juga nggak pernah bisa, nomor customer support yang No HP juga nggak ada WA nya. Dah lah mending UNINSTALL aja, kecewa banget...!",1,2,,2022-10-29 03:05:00,makasih ya atas rating dan reviewnya. Mohon maaf atas kendala yang dialami. akan kami tingkatkan kembali kedepannya kak :),2022-10-30 06:51:38,
a857afd5-c745-4681-bd8a-6737721e8fb4,AINUL PITRI,https://play-lh.googleusercontent.com/a-/ALV-UjXlw5cA7f6o71jCbrmNs3Sh79lS-_nkts7R-ScdHxUOKu_WOrrH,"Minta tolong perbaiki lagi, sering pesan tapi saat saya sudah mengatur alamat yang benar tiba-tiba malah kealamat lain😭",3,2,3.1.7,2022-10-27 19:42:49,makasih ya atas rating dan reviewnya. Mohon maaf atas kendala yang dialami. akan kami tingkatkan kembali kedepannya kak :),2022-10-30 06:51:35,3.1.7
8920372c-745b-4a4f-9493-6dcd3ee2abed,Adinda Rabiki,https://play-lh.googleusercontent.com/a/ACg8ocIef5MGD-vhjuIo5vHy0xcMIbMCO5nw9zqxyxDHDi_A8SRzNw=mo,"Performa menurun, ga bisa cancel driver padahal udah 30 menit nunggu. Ga digubris² tapi pesanan kita bisa di cancel seenaknya. Belum bales chat 1 menit ajaa langsung di cancel dengan alasan costumer susah dihubungi",3,14,3.1.7,2022-10-27 15:42:39,makasih ya atas rating dan reviewnya. Mohon maaf atas kendala yang dialami. akan kami tingkatkan kembali kedepannya kak :),2022-10-27 16:58:39,3.1.7
67240692-1af6-4268-af2c-8b3d6f54840e,Aghon Anto,https://play-lh.googleusercontent.com/a-/ALV-UjUL8P8xFezIYK6UJi7XTSzrgmcv8hZFTjkOjHgc9np27JPrP14,Baik,5,2,3.1.7,2022-10-27 01:35:38,makasih ya atas rating dan reviewnya. Mohon maaf atas kendala yang dialami. akan kami tingkatkan kembali kedepannya kak :),2022-10-27 05:40:30,3.1.7
af3d11ab-2607-49cc-9f83-5c4854c120d1,Andi Sudarsono,https://play-lh.googleusercontent.com/a/ACg8ocJNnIMHF2SJC0NRDYoTpMMSqmP7bLbhyDEoWTkBSPYa8U7snw=mo,baru mau pakai driver gak ada respon,1,0,3.1.7,2022-10-25 06:58:20,makasih ya atas rating dan reviewnya. Mohon maaf atas kendala yang dialami. akan kami tingkatkan kembali kedepannya kak :),2022-10-25 10:20:04,3.1.7
f6ec4007-ec33-4ac2-ade2-48ee7c9975cb,Sabar Maulana,https://play-lh.googleusercontent.com/a-/ALV-UjV6CcnwCKY_LtA2e8hnN5D0dupoW-8SZntX-LMPbpyRUVRVBjBV,Aplikasinya bagus tapis sayang kaga ada pitur pitur evocher (Pulsa atau paket data ),4,1,,2022-10-25 04:10:33,makasih ya atas rating dan reviewnya. Mohon maaf atas kendala yang dialami. akan kami tingkatkan kembali kedepannya kak :),2022-10-25 10:20:02,
abf0f380-ef58-416b-8626-1a137088d193,Zilong Binti,https://play-lh.googleusercontent.com/a/ACg8ocJKc7aEJWqU9SZFysL4sRmmrc-25i5JOWW-JKevkJVeZ0O4eg=mo,Gk bagus Otp nya gk di kirim,1,0,3.1.7,2022-10-24 21:32:43,makasih ya atas rating dan reviewnya. Mohon maaf atas kendala yang dialami. akan kami tingkatkan kembali kedepannya kak :),2022-10-25 10:20:00,3.1.7
b5f4399b-c9c8-47fa-9986-40179db3b2d2,Sasuke,https://play-lh.googleusercontent.com/a-/ALV-UjWuhXR4hNrVCruT-CX3d5zgWzefdhigBUl_X8WxN6rdBD4q2yxK,Kode otp lama,1,0,,2022-10-24 16:59:49,makasih ya atas rating dan reviewnya. Mohon maaf atas kendala yang dialami. akan kami tingkatkan kembali kedepannya kak :),2022-10-25 10:19:58,
b8acb6b3-6394-42ab-9df2-9815eae743b1,Roro Condro Kirono,https://play-lh.googleusercontent.com/a-/ALV-UjXPV5Ke02NKi4fcT5pr6JyO0RQ40xlcOrEfim7XNnkn0Vh9SWmT,Masih agak ribet ketika mw pilih lokasi pengambilannya,4,1,3.1.5,2022-10-24 09:44:07,makasih ya atas rating dan reviewnya. Mohon maaf atas kendala yang dialami. akan kami tingkatkan kembali kedepannya kak :),2022-10-25 10:19:53,3.1.5
db04a248-b602-4b92-aae1-486be526d7e1,Gita Jatmiko,https://play-lh.googleusercontent.com/a-/ALV-UjUx_ZJBOJdoS18kzRh-8NUb-xutx7VJNt6nkqpnuMvvZeoT6NU,lemot bet anjr,1,0,3.1.7,2022-10-24 05:29:06,makasih ya atas rating dan reviewnya. Mohon maaf atas kendala yang dialami. akan kami tingkatkan kembali kedepannya kak :),2022-10-25 10:19:47,3.1.7
0f851081-a98d-4e28-b88e-afb155c41327,Suibberutu,https://play-lh.googleusercontent.com/a/ACg8ocJbDSWdiDuRZdVoZi_yZmERWCsGrBupY-jb-xpBIndMj0RKMg=mo,Event invite teman 5k yg masuk cman 2k,1,0,3.1.7,2022-10-24 03:42:48,makasih ya atas rating dan reviewnya. Mohon maaf atas kendala yang dialami. akan kami tingkatkan kembali kedepannya kak :),2022-10-25 10:19:43,3.1.7
75e89bb4-2f12-43e1-9d8a-afdf747bbbdb,Sella Claudia,https://play-lh.googleusercontent.com/a/ACg8ocLaxLSdgcAOKqGRIdM7lduloLXviKPRlYcupiySt5TrPOQt7Q=mo,Terima kasih,5,2,3.1.7,2022-10-23 00:55:45,makasih ya atas rating dan reviewnya. Mohon maaf atas kendala yang dialami. akan kami tingkatkan kembali kedepannya kak :),2022-10-25 10:14:59,3.1.7
b0a50d0a-c108-4166-86e1-809ec3e85228,amir uddin,https://play-lh.googleusercontent.com/a-/ALV-UjXaLneEuahCuu5V5o4_DCN3dSmBh-oXrp3D526cOi57DsYp2uio,"joassssss, wesssss",5,2,3.1.7,2022-10-22 17:38:08,makasih ya atas rating dan reviewnya. Mohon maaf atas kendala yang dialami. akan kami tingkatkan kembali kedepannya kak :),2022-10-25 10:14:55,3.1.7
d052be27-e3f3-4e07-9bf8-dc3ae7349743,Yunita Yunita,https://play-lh.googleusercontent.com/a-/ALV-UjXvbCRmQ3crNAqqINnbkAKZ089CAy3tCEj3YrL3Zc0r9fzb9A,"Pertama Kali pakai app ini kok perjalananya gk muncul ya? cuma Muncul pas driver menuju ttk jpt. tp Murah jg sih,smg skses.",4,4,3.1.6,2022-10-22 14:16:15,makasih ya atas rating dan reviewnya. Mohon maaf atas kendala yang dialami. akan kami tingkatkan kembali kedepannya kak :),2022-10-25 10:14:52,3.1.6
834c1d35-82c6-46af-83b8-a4995a4abb76,Moba Gaming,https://play-lh.googleusercontent.com/a-/ALV-UjXx0vle_c3GpDYTewvxsNfc0AVAPno7e5OuH481pjp-Y_t96PKk,Apk tolol udah ngundang banyak orang malah krna suspend apk babi,1,0,3.1.7,2022-10-22 11:51:16,makasih ya atas rating dan reviewnya. Mohon maaf atas kendala yang dialami. akan kami tingkatkan kembali kedepannya kak :),2022-10-25 10:14:47,3.1.7
a1b9fddc-0d29-4c09-b4e7-0b471877a1b9,Erik Nakal,https://play-lh.googleusercontent.com/a/ACg8ocIpZC4i2Kso7CyGjeLFg3pwOCcHyzryWvWwkneQbfCMIrVdTw=mo,Kalo bikin aplikasi yg bener. Mau login otp susah. Ada event undang teman dapet 5k kadang masuk kadang kaga saldo nyah. Kalo kaga mau rugi jangan bikin aplikasi ke ginih. So soan event undang teman dapet 5k kaga tau nyah takut rugi,1,6,3.1.7,2022-10-21 23:24:19,makasih ya atas rating dan reviewnya. Mohon maaf atas kendala yang dialami. akan kami tingkatkan kembali kedepannya kak :),2022-10-22 08:32:06,3.1.7
b1e6ef43-4b8d-49e2-9b25-da3dbcc5568e,Sanz Peace,https://play-lh.googleusercontent.com/a-/ALV-UjW24R42tMJTJzjoKBXWg8Tmw02mpyfeLnbzBYYbNbiiOOUsUk8,Gak berlalu Di luar Jogja Misalkan Aku dari Makassar Gak Bisa Daftar,1,0,3.1.5,2022-10-21 22:57:10,makasih ya atas rating dan reviewnya. Mohon maaf atas kendala yang dialami. akan kami tingkatkan kembali kedepannya kak :),2022-10-22 08:32:02,3.1.5
00e9b164-6d17-415b-a892-a387922acfff,TomasWibowo Tomas,https://play-lh.googleusercontent.com/a-/ALV-UjVurE5Z-qKb1ehrKBwwiKsTjVoEPPCDZktYOns-HVG1ThPkFrab,Apk erorr gak jelas udah daftar malah balik ke verifikasi mulu jangan download dah apk ini,1,0,,2022-10-21 19:23:31,makasih ya atas rating dan reviewnya. Mohon maaf atas kendala yang dialami. akan kami tingkatkan kembali kedepannya kak :),2022-10-22 08:31:59,
ec86a824-923c-4bba-a267-b20fda3406b0,JURI YANTO,https://play-lh.googleusercontent.com/a/ACg8ocIFXAqpUt278VIAp6uHcx8Yno8dmsB7Y1FtGc8jmURHEW940Q=mo,ko pas kyc selalau di tolak apkah kususs orangg jogjaa,1,0,3.1.7,2022-10-21 17:11:01,makasih ya atas rating dan reviewnya. Mohon maaf atas kendala yang dialami. akan kami tingkatkan kembali kedepannya kak :),2022-10-22 08:31:55,3.1.7
f9642f08-68a3-4623-b145-925e47018502,Mohamad Khoirun niam,https://play-lh.googleusercontent.com/a-/ALV-UjXEJAl31s791vVVFrDmVHYrgA3o9fX6aXINaCPgwHpfMzyNV-WR,"Aplikasi gajelas,kenapa akunku tiba² terkunci gak bisa login.kasih bintang 1 aja",1,2,3.1.7,2022-10-21 10:31:30,makasih ya atas rating dan reviewnya. Mohon maaf atas kendala yang dialami. akan kami tingkatkan kembali kedepannya kak :),2022-10-20 06:55:35,3.1.7
2be1fc65-c7b6-4ae6-9ae0-5815156f49ba,Ega Saputra,https://play-lh.googleusercontent.com/a-/ALV-UjXYIXhnLAdhbcfRs4txeAc3HCenv23UhDR8D9Y2Uf5YVFcO58E,Mana otp nya oiiii,5,2,3.1.7,2022-10-21 07:40:18,makasih ya atas rating dan reviewnya. Mohon maaf atas kendala yang dialami. akan kami tingkatkan kembali kedepannya kak :),2022-10-21 08:30:18,3.1.7
8d033390-6473-4ccb-ade9-8e4d52d055ac,Bang Memed,https://play-lh.googleusercontent.com/a-/ALV-UjV1XAZnQ4Yqz1MN-TTQcID5I6ylVJyMnllXv8l2UHsusbwzGwo,Modal motor 20tj hp 3jt orderan tidak ada udah beli jaket 200 aplikasi apa ini,1,0,,2022-10-20 21:07:50,makasih ya atas rating dan reviewnya. Mohon maaf atas kendala yang dialami. akan kami tingkatkan kembali kedepannya kak :),2022-10-21 08:30:04,
6416b5f3-b31d-4872-b966-5c3834d86b90,Rafisky Alyandra,https://play-lh.googleusercontent.com/a/ACg8ocK_Lonbhm-rO_HzE9KjIf2Jyae_SLx-GKJAgPSDlY4i8P_2Sw=mo,Parah aplikasi gak jelass bangett,1,0,,2022-10-20 16:57:27,makasih ya atas rating dan reviewnya. Mohon maaf atas kendala yang dialami. akan kami tingkatkan kembali kedepannya kak :),2022-10-21 08:29:59,
2e56966b-8c22-4cf4-8dde-5adfc7c05cd5,Ade Putra Pratama,https://play-lh.googleusercontent.com/a/ACg8ocJ3GutNx3OjssH6Px7xieweuzbQgYuDIll_EXPdl34oA147CA=mo,"Katanya akun gua curang, padah reff murni haahha bintang 1, auto uninstall",1,0,,2022-10-20 12:27:40,makasih ya atas rating dan reviewnya. Mohon maaf atas kendala yang dialami. akan kami tingkatkan kembali kedepannya kak :),2022-10-21 08:28:39,
328473ad-a442-40e4-98c6-3381c62cd707,Rizky Gy,https://play-lh.googleusercontent.com/a/ACg8ocJcvnWMHXXMR3LfS5_1cYKtYKo7PaJT6iHSESWLG9-3x3prsQ=mo,Jangan kirim kode otp kalo terus salah oke,1,0,3.1.7,2022-10-20 10:49:28,makasih ya atas rating dan reviewnya. Mohon maaf atas kendala yang dialami. akan kami tingkatkan kembali kedepannya kak :),2022-10-21 08:28:21,3.1.7
ea733432-05f7-4355-98c8-50ce55b9ff2c,Samsul Rizal,https://play-lh.googleusercontent.com/a/ACg8ocIW2XBVXkcgf3dGqkidCnaN_lyePIW14H-ox6mx3MdmNlul4Q=mo,Baru juga Saya melakukan TopUp Saldo buat beli kuota ehh malah akun ditolak sistem kan aneh,1,2,3.1.6,2022-10-19 20:27:12,makasih ya atas rating dan reviewnya. Mohon maaf atas kendala yang dialami. akan kami tingkatkan kembali kedepannya kak :),2022-10-19 23:26:06,3.1.6
40b7e89a-7eb6-4565-ba8d-6a865b4daae6,Zahrotul Mutmainah,https://play-lh.googleusercontent.com/a/ACg8ocLCZQXqaR9FVAjIZKZIGpQzkBDFlNHANvQm2wBdzZ2KHxakJQ=mo,Mantap,5,2,,2022-10-19 19:46:56,makasih ya atas rating dan reviewnya. Mohon maaf atas kendala yang dialami. akan kami tingkatkan kembali kedepannya kak :),2022-10-19 23:22:30,
f1f9ac92-9835-4a9d-b76c-5f4e6a2d4ee9,Maesaroh Eloh,https://play-lh.googleusercontent.com/a/ACg8ocL6DOMC5o102KIxw6Dfv2Dk6sPNWIPVaGZAFMf3TiIXvBHJrw=mo,cacat otp udah bner mlah fc ... mending sekolah dulu baru bikin aplikasi yang bener,1,0,,2022-10-19 03:26:54,makasih ya atas rating dan reviewnya. Mohon maaf atas kendala yang dialami. akan kami tingkatkan kembali kedepannya kak :),2022-10-19 06:34:29,
13510d99-a0ab-4d61-8b65-60a45fc390fe,Dedi Bae,https://play-lh.googleusercontent.com/a/ACg8ocLcMTNQgx2z3A_c8MMNqYZQtDJdCyZ3Co3QgP7jTKGjCrF8gA=mo,"Apk gak jelas, top up emoney gak bisa, isi pulsa n pln gak bisa.trus saldo nya saya buat apaan? Wkwkwk",1,0,,2022-10-18 22:16:56,makasih ya atas rating dan reviewnya. Mohon maaf atas kendala yang dialami. akan kami tingkatkan kembali kedepannya kak :),2022-10-19 06:34:26,
51bc4e93-2d52-4204-8966-4865f3826dc3,Arief 8600,https://play-lh.googleusercontent.com/a/ACg8ocIzsP9tJun5u5uEIgEwEZPGjCEch6apUuoZzpVJ4BbHejnTkg=mo,"pesan makanan tapi tidak pernah sampai, keterangan orderan selesai tapi hoaxs. merasa tertipuuuu",1,1,3.1.5,2022-10-18 18:36:10,makasih ya atas rating dan reviewnya. Mohon maaf atas kendala yang dialami. akan kami tingkatkan kembali kedepannya kak :),2022-10-19 06:34:23,3.1.5
f99ef0e1-5b38-4a9a-978f-4dec43553280,ilmu pena,https://play-lh.googleusercontent.com/a-/ALV-UjXMS8wCIiZFEAXCc9sdYO2LAhUIo0sxRE1CiaSfnf9xWPqrdRCr,daftarnya puter puter trs di kode otp.. gmn mau bisa pakai??,1,0,,2022-10-18 12:28:58,makasih ya atas rating dan reviewnya. Mohon maaf atas kendala yang dialami. akan kami tingkatkan kembali kedepannya kak :),2022-10-19 06:34:19,
6b6d3fec-84e0-431b-b4c8-55a722333bd3,mahendra rosandi,https://play-lh.googleusercontent.com/a/ACg8ocJPLnANv14OyMbUrjyW7MuRinUPksjgPQFrvrZbJ-ggN6sp5A=mo,apk buruk !!,1,0,3.1.6,2022-10-18 09:47:28,makasih ya atas rating dan reviewnya. Mohon maaf atas kendala yang dialami. akan kami tingkatkan kembali kedepannya kak :),2022-10-19 06:34:16,3.1.6
c1e4d281-98cc-4db2-8a28-07ac022c7a7a,Tyas Moer,https://play-lh.googleusercontent.com/a-/ALV-UjWYAWEgRr8ccE2N-D9zoHOxnFpDcGOpH61dD0ISdg0zZlNuGQdZ,"pelayanan bagus, cepat",5,3,3.1.0,2022-10-17 12:42:38,makasih ya atas rating dan reviewnya. Mohon maaf atas kendala yang dialami. akan kami tingkatkan kembali kedepannya kak :),2022-10-19 06:34:11,3.1.0
c415ab68-5c3e-45c3-babf-9ae1a3554e61,Ffd Hhg,https://play-lh.googleusercontent.com/a/ACg8ocJIQPGXpYIKvfNwVPqzq3ZkeEMU_NqaSvC6ckEnMfvGdxNhYg=mo,Saldo nggak bisa di gunain,1,0,3.1.5,2022-10-17 11:39:37,makasih ya atas rating dan reviewnya. Mohon maaf atas kendala yang dialami. akan kami tingkatkan kembali kedepannya kak :),2022-10-19 06:34:06,3.1.5
a6424f78-ef71-4d01-95f7-4340bba07d9f,Yoga Gilang,https://play-lh.googleusercontent.com/a-/ALV-UjVUDj7SilCAMZjrZEl5TmWZoUw10xhXyyD2HnEvMpzlXbGU5F2_,"tolong diperbaiki lagi aplikasinya, aplikasinya masih sering ngebug dan eror. ketika saya pesan food, saya tdk bisa membalas cht driver dan ketika saya pencet tombol tlpn juga tidak bisa. saat itu driver harus konfirmasi pesanan dikarenakan stok ada yg kosong. dan juga kasihan jika yg kena imbasnya driver karena pengantaran terlalu lama. mohon diperbaiki lagi aplikasinya karena ini akan menjadi kesalah pahaman. kasian juga driver yg gatau apa2 tbtb kena pelanggaran.",4,25,3.1.5,2022-10-17 09:29:28,makasih ya atas rating dan reviewnya. Mohon maaf atas kendala yang dialami. akan kami tingkatkan kembali kedepannya kak :),2022-10-17 09:23:37,3.1.5
8159bf4b-6adc-478f-a4fc-638ca56b531e,Sudarman Darman,https://play-lh.googleusercontent.com/a/ACg8ocKZUFQhy_ILXdmNKJreNGjWHaP3rcFhNHQeWWBDrqqdK0O4GQ=mo,murah ongkos nya,5,3,3.1.5,2022-10-17 07:08:45,makasih ya atas rating dan reviewnya. Mohon maaf atas kendala yang dialami. akan kami tingkatkan kembali kedepannya kak :),2022-10-17 09:22:51,3.1.5
d0f48c1b-407e-410e-b664-a0f6e3477631,Abil Fisabilillah,https://play-lh.googleusercontent.com/a/ACg8ocIYYHVZ0fhEbAvTlBVa53Bwm0pwYaPIIrT8KrsGTtyBbRlzUw=mo,Kecewa dengan pelayanan cs,1,0,,2022-10-16 16:31:44,makasih ya atas rating dan reviewnya. Mohon maaf atas kendala yang dialami. akan kami tingkatkan kembali kedepannya kak :),2022-10-17 09:23:05,
1fdca068-7b86-4fbd-9201-7e4d701d3dd6,Rio Alamsyah,https://play-lh.googleusercontent.com/a/ACg8ocKIOnpuNdbM4BzzMV2LWfPtpQVHwANb2AhJRr23vUUs57gG=mo,"Baru instal stuck di OTP, dapet missed call tapi tetep ngga bisa masuk",2,0,,2022-10-16 14:52:33,makasih ya atas rating dan reviewnya. Mohon maaf atas kendala yang dialami. akan kami tingkatkan kembali kedepannya kak :),2022-10-17 09:23:09,
78c8037b-cf34-4ae2-9739-388d2cede50c,Nyoman Aris,https://play-lh.googleusercontent.com/a/ACg8ocJ4FN-vB3dT-Wr4qxUgWW71xnreg188SeqLpzB4m8nmaDHSzQ=mo,sangat membantu..2rb bs antar kmn2,5,3,3.1.5,2022-10-16 14:49:42,makasih ya atas rating dan reviewnya. Mohon maaf atas kendala yang dialami. akan kami tingkatkan kembali kedepannya kak :),2022-10-17 09:23:28,3.1.5
dc42dc3a-5b5b-4e29-a257-35bd17c0af5c,Ramadhani Tyas,https://play-lh.googleusercontent.com/a-/ALV-UjU0PHIhuYDO_j42ShXSEfLUMw7gBpZyDzxxlm8lmAs8TYYy_EJM,Ini gimana yaa saya isi saldo 2x tp yang masuk cuma 1 pdahal di rekening sdh berkurang 2x,2,0,3.1.5,2022-10-16 10:04:15,makasih ya atas rating dan reviewnya. Mohon maaf atas kendala yang dialami. akan kami tingkatkan kembali kedepannya kak :),2022-10-17 09:23:32,3.1.5
cf6c8cab-acc2-49e5-bed5-0ef063af1ff7,Iksan Bilian,https://play-lh.googleusercontent.com/a-/ALV-UjWqLe27h53dcGiA-4wobh9wqxxdiVzc5lZjTMHuPImWwEQwNsc,Apk jelek customer service nyaa bodo gausah pda pake,1,0,,2022-10-15 16:57:45,makasih ya atas rating dan reviewnya. Mohon maaf atas kendala yang dialami. akan kami tingkatkan kembali kedepannya kak :),2022-10-17 09:23:56,
c615bb50-c43b-4326-9fa3-ac4560afe635,Febri Titis S,https://play-lh.googleusercontent.com/a-/ALV-UjWr1t0u6yF0dZzQgwrqFhvXP-Jzf5L_nvxCbCTrCq1R9xHBBkJP,"Sebenernya bangga ada aplikasi ini,cuma sayang lama pesen sampek 1 jam dan driver banyak yg batalkan juga",1,2,3.1.5,2022-10-15 13:17:19,makasih ya atas rating dan reviewnya. Mohon maaf atas kendala yang dialami. akan kami tingkatkan kembali kedepannya kak :),2022-10-17 09:24:01,3.1.5
